comment_id,submission_id,comment_author,comment_body,comment_score,comment_parent_id,comment_created_utc,created_datetime,subreddit,query,source,bronze_year,bronze_month,bronze_day,bronze_source_file,title,text,url,post_author,score,num_comments,upvote_ratio,created_utc,author,body,parent_id,1p5fb6j,48 billion math error ?,"Just came across this on my feed. If all that is true, it’s very concerning.

“…Strategy Inc. just disclosed something extraordinary. They own 649,870 Bitcoin. That is 3.26 percent of every Bitcoin that will ever exist. Total cost: $48.37 billion.

They also disclosed the numbers that prove this cannot survive the next 90 days….”

“…Strategy has $54 million in cash. They owe $700 million per year in preferred stock dividends. Their software business generates negative cash flow. To pay dividends, they must raise $700 million in new capital every single year before buying a single additional Bitcoin...”

https://x.com/shanaka86/status/1992740665957155059?s=46

",https://www.reddit.com/r/CryptoCurrency/comments/1p5fb6j/48_billion_math_error/,Hidden5G,0,10,0.47,CryptoCurrency,bitcoin OR ethereum,reddit_post,1763985909.0,2025-11-24T12:05:09,combined_text,sentiment,sentiment_confidence
,1perbm2,,,,,,2025-12-05T10:04:05,CryptoCurrency,bitcoin,reddit_post,2025,1,1,reddit_posts_20250101.csv,JPMorgan says Strategy's resilience is key to bitcoin's price direction in the near term,,https://www.theblock.co/post/381442/jpmorgan-strategy-bitcoin-price-outlook,DryMyBottom,8.0,0.0,0.79,1764929045.0,,,,,,,,,,,,,,,,,JPMorgan says Strategy's resilience is key to bitcoin's price direction in the near term ,positive,0.9912652373313904
,1peaph0,,,,,,2025-12-04T20:22:32,CryptoCurrency,bitcoin,reddit_post,2025,1,1,reddit_posts_20250101.csv,Bitcoin may avoid a major drawdown this cycle,,https://peakd.com/hive-167922/@pele23/bitcoin-may-avoid-a-major-drawdown-this-cycle-gyd,x___rain,0.0,0.0,0.2,1764879752.0,,,,,,,,,,,,,,,,,Bitcoin may avoid a major drawdown this cycle ,negative,0.9836254715919495
,1pd0acq,,,,,,2025-12-03T10:02:07,CryptoCurrency,bitcoin,reddit_post,2025,1,1,reddit_posts_20250101.csv,BlackRock's Spot Bitcoin ETF Options Secure U.S. Top 10 Ranking With 7.7M Active Contracts,,https://www.coindesk.com/markets/2025/12/03/blackrock-s-spot-bitcoin-etf-secures-top-10-spot-in-u-s-options-universe-with-7-7m-ibit-active-contracts,DryMyBottom,8.0,0.0,0.83,1764756127.0,,,,,,,,,,,,,,,,,BlackRock's Spot Bitcoin ETF Options Secure U.S. Top 10 Ranking With 7.7M Active Contracts ,negative,0.984187126159668
nlsrsug,1oi3mp8,,,2.0,,1761643029.0,2025-10-28T10:17:09,CryptoCurrency,bitcoin,reddit_post,2025,10,28,reddit_posts_20251028_112145.csv,Bitcoin Stays Strong as US Inflation Slows,,https://en.coin-turk.com/bitcoin-stays-strong-as-us-inflation-slows/,,10.0,2.0,0.81,1761638976.0,DryMyBottom,We are just one post or comment from him away from seeing the market turn red again.,t3_1oi3mp8,,,,,,,,,,,,,,Bitcoin Stays Strong as US Inflation Slows ,positive,0.5982898473739624
nls7vtw,1oi1ojv,,,8.0,,1761631335.0,2025-10-28T07:02:15,CryptoCurrency,bitcoin,reddit_post,2025,10,28,reddit_posts_20251028_112145.csv,"S&P Global assigns B- rating to Saylor’s Strategy, cites “high bitcoin concentration”",,https://finance.yahoo.com/news/amp-p-global-assigns-b-225021901.html,,25.0,9.0,0.93,1761630956.0,gdscrypto,Why does Saylor look more and more like McAffee?,t3_1oi1ojv,,,,,,,,,,,,,,"S&P Global assigns B- rating to Saylor’s Strategy, cites “high bitcoin concentration” ",positive,0.9478022456169128
nlqx5rn,1ohvp52,,,270.0,,1761612808.0,2025-10-28T01:53:28,CryptoCurrency,bitcoin,reddit_post,2025,10,28,reddit_posts_20251028_112145.csv,Trump Sons' American Bitcoin Stock Jumps After Adding $163 Million to BTC Treasury,,https://decrypt.co/346068/trump-sons-american-bitcoin-jumps-adding-163-million-treasury,,656.0,75.0,0.96,1761612102.0,Abdeliq,So where are all those Magats who complained about Hunter making money off his dad’s position?,t3_1ohvp52,,,,,,,,,,,,,,Trump Sons' American Bitcoin Stock Jumps After Adding $163 Million to BTC Treasury ,negative,0.8080936670303345
nlpwnzz,1ohpf9h,,,60.0,,1761600643.0,2025-10-27T22:30:43,CryptoCurrency,bitcoin,reddit_post,2025,10,28,reddit_posts_20251028_112145.csv,"S&P Global Ratings has issued a credit rating (B-) to Michael Saylor’s Strategy, the first time for any Bitcoin treasury company.",,https://i.redd.it/5pkruhsxqpxf1.png,,111.0,38.0,0.94,1761596576.0,002_timmy,Now Saylor needs to make enough money to buy these Triple A ratings from the rating firms.,t3_1ohpf9h,,,,,,,,,,,,,,"S&P Global Ratings has issued a credit rating (B-) to Michael Saylor’s Strategy, the first time for any Bitcoin treasury company. ",positive,0.933229923248291
nlpf9sc,1oho6b3,,,21.0,,1761595308.0,2025-10-27T21:01:48,CryptoCurrency,bitcoin,reddit_post,2025,10,28,reddit_posts_20251028_112145.csv,"Strategy (MSTR) Earns S&P ‘B-’ Rating, Marking A Major Milestone For Bitcoin-Backed Credit",,https://bitcoinmagazine.com/bitcoin-for-corporations/strategy-mstr-bitcoin-backed-credit-rating-milestone?utm_source=coingecko&utm_content=coingecko&utm_campaign=coingecko&utm_medium=coingecko&utm_term=coingecko,,28.0,10.0,0.89,1761593771.0,KIG45,"Oh yay.

Its B- rating is worse than the starting Junk Bond rating (BB+)",t3_1oho6b3,,,,,,,,,,,,,,"Strategy (MSTR) Earns S&P ‘B-’ Rating, Marking A Major Milestone For Bitcoin-Backed Credit ",negative,0.9982183575630188
nlpfwk0,1oho1pl,,,2.0,,1761595502.0,2025-10-27T21:05:02,CryptoCurrency,bitcoin,reddit_post,2025,10,28,reddit_posts_20251028_112145.csv,Saylor's Strategy the First Bitcoin Treasury Company Rated by Major Credit Agency,,https://www.coindesk.com/markets/2025/10/27/saylor-s-strategy-the-first-bitcoin-treasury-company-rated-by-major-credit-agency,,27.0,4.0,0.88,1761593473.0,Calm_Voice_9791,"They rated it B-, which is equivalent to a Junk Bond rating (starts at BB+)",t3_1oho1pl,,,,,,,,,,,,,,Saylor's Strategy the First Bitcoin Treasury Company Rated by Major Credit Agency ,negative,0.9991846680641174
nlqmhi6,1ohnj1l,,,18.0,,1761609228.0,2025-10-28T00:53:48,CryptoCurrency,bitcoin,reddit_post,2025,10,28,reddit_posts_20251028_112145.csv,Drama around Bitcoin Taproot exploit that allows storing CSAM on BTC blockchain continues,"TIL the BTC node codebase is controlled by reatards who added the ability to put child p\*orn on the BTC blockchain. They don't seem to care because that will cause mining fees to increase. Some other lunatics are trying to mitigate the risk of this exploit, but their method is somewhat controversial and includes some legal threats. 

Hard to believe the inmates are running the asylum over at Blockstream, and this loon Luke Dashjr is also fairly nutty. This is a network worth trillions of dollars!",https://github.com/bitcoin/bips/pull/2017/files,,18.0,39.0,0.67,1761592312.0,YogurtCloset3335,Any immutable blockchain makes this possible?,t3_1ohnj1l,,,,,,,,,,,,,,"Drama around Bitcoin Taproot exploit that allows storing CSAM on BTC blockchain continues TIL the BTC node codebase is controlled by reatards who added the ability to put child p\*orn on the BTC blockchain. They don't seem to care because that will cause mining fees to increase. Some other lunatics are trying to mitigate the risk of this exploit, but their method is somewhat controversial and includes some legal threats. 

Hard to believe the inmates are running the asylum over at Blockstream, and this loon Luke Dashjr is also fairly nutty. This is a network worth trillions of dollars!",negative,0.8903377056121826
nlotbne,1ohlegz,,,1.0,,1761588607.0,2025-10-27T19:10:07,CryptoCurrency,bitcoin,reddit_post,2025,10,28,reddit_posts_20251028_112145.csv,Why Traders Should Watch the Bitcoin to Gold Ratio,,https://decrypt.co/346066/why-traders-should-watch-bitcoin-gold-ratio,,2.0,1.0,0.67,1761587597.0,DirectionMundane5468,"tldr; The Bitcoin-to-gold ratio is an important metric for traders to monitor, as it reflects market sentiment and comparative performance. Recent optimism around U.S.-China trade talks has improved the ratio, though fears remain. Bitcoin ETF inflows have lagged behind gold ETFs, suggesting potential for catch-up. Bitcoin has gained recently, partly due to gold retreating from its all-time high. Analysts suggest watching for the ratio to break above 30 as a signal of reduced market fear.

*This summary is auto generated by a bot and not meant to replace reading the original article. As always, DYOR.",t3_1ohlegz,,,,,,,,,,,,,,Why Traders Should Watch the Bitcoin to Gold Ratio ,positive,0.9885554909706116
nlnqpri,1ohgohy,,,2.0,,1761577206.0,2025-10-27T16:00:06,CryptoCurrency,bitcoin,reddit_post,2025,10,28,reddit_posts_20251028_112145.csv,Uptober? Strategy logs slowest monthly Bitcoin buys of the year at 778 BTC,,https://cointelegraph.com/news/strategy-buys-778-bitcoin-october-buying-activity-slowdown,,4.0,2.0,0.63,1761577130.0,DryMyBottom,"tldr; Michael Saylor’s Strategy, the largest public Bitcoin holder, added 390 BTC worth $43.3 million in October, bringing its total holdings to 640,808 BTC. However, October's accumulation of 778 BTC marks the slowest monthly purchase this year, down 78% from September's 3,526 BTC. The slowdown is attributed to capital raising difficulties, with equity issuance premiums dropping significantly. Despite reduced buying, Strategy maintains long-term conviction in Bitcoin investments, having spent $19.53 billion on BTC acquisitions in 2025 so far.

*This summary is auto generated by a bot and not meant to replace reading the original article. As always, DYOR.",t3_1ohgohy,,,,,,,,,,,,,,Uptober? Strategy logs slowest monthly Bitcoin buys of the year at 778 BTC ,positive,0.9676112532615662
nlnqqdt,1ohgjtn,,,1.0,,1761577211.0,2025-10-27T16:00:11,CryptoCurrency,bitcoin,reddit_post,2025,10,28,reddit_posts_20251028_112145.csv,"Bitcoin price breaks out of triangle at $115K, bullish momentum or bear trap ahead?",,https://crypto.news/bitcoin-price-breaks-out-of-triangle-at-115k-bullish-momentum-or-bear-trap-ahead/,,10.0,2.0,0.73,1761576836.0,DryMyBottom,"tldr; Bitcoin has broken out of a local triangle pattern, surging toward $115,000, signaling short-term bullish momentum. However, $115,000 acts as a critical resistance level and potential bull trap zone. A confirmed breakout above this level with strong volume could target $125,000–$130,000, while failure to sustain above it may lead to a retracement toward $90,000. The move follows weeks of consolidation, and volume confirmation will be key to determining whether the breakout is sustainable or a false signal.

*This summary is auto generated by a bot and not meant to replace reading the original article. As always, DYOR.",t3_1ohgjtn,,,,,,,,,,,,,,"Bitcoin price breaks out of triangle at $115K, bullish momentum or bear trap ahead? ",negative,0.9902483820915222
nlncdg4,1ohehe2,,,18.0,,1761572725.0,2025-10-27T14:45:25,CryptoCurrency,bitcoin,reddit_post,2025,10,28,reddit_posts_20251028_112145.csv,When Bitcoin breaks $113K and Peter Schiff still refuses to look,Source: [https://x.com/naiivememe/status/1982439581195895095](https://x.com/naiivememe/status/1982439581195895095),https://i.redd.it/l7wec5skpnxf1.png,,344.0,17.0,0.9,1761571887.0,kirtash93,Why should a Bitcoin Maxi care about the short term price?,t3_1ohehe2,,,,,,,,,,,,,,When Bitcoin breaks $113K and Peter Schiff still refuses to look Source: [https://x.com/naiivememe/status/1982439581195895095](https://x.com/naiivememe/status/1982439581195895095),positive,0.9180551767349243
nln5g0b,1ohdl4a,,,0.0,,1761570331.0,2025-10-27T14:05:31,CryptoCurrency,bitcoin,reddit_post,2025,10,28,reddit_posts_20251028_112145.csv,JPMorgan to Let Clients Use Crypto as Collateral for Loans,"JPMorgan is developing a framework that will allow institutional clients to use Bitcoin and Ethereum as collateral for loans. The program is expected to launch by the end of 2025 under a third-party custody model where approved custodians hold the pledged tokens. This marks one of the most direct integrations of crypto assets into Wall Street's credit systems to date. It positions BTC and ETH within the same collateral ecosystem as traditional instruments like Treasuries and equities. The move introduces significant operational challenges, as banks must now manage 24/7 mark-to-market assets with real-time volatility modeling, dynamic margin requirements, and custodial risk insurance within legacy settlement infrastructure.",https://www.reddit.com/r/CryptoCurrency/comments/1ohdl4a/jpmorgan_to_let_clients_use_crypto_as_collateral/,,7.0,2.0,0.82,1761569582.0,kenashe,A new bubble?,t3_1ohdl4a,,,,,,,,,,,,,,"JPMorgan to Let Clients Use Crypto as Collateral for Loans JPMorgan is developing a framework that will allow institutional clients to use Bitcoin and Ethereum as collateral for loans. The program is expected to launch by the end of 2025 under a third-party custody model where approved custodians hold the pledged tokens. This marks one of the most direct integrations of crypto assets into Wall Street's credit systems to date. It positions BTC and ETH within the same collateral ecosystem as traditional instruments like Treasuries and equities. The move introduces significant operational challenges, as banks must now manage 24/7 mark-to-market assets with real-time volatility modeling, dynamic margin requirements, and custodial risk insurance within legacy settlement infrastructure.",positive,0.988020122051239
nlmme65,1ohb080,,,1.0,,1761562219.0,2025-10-27T11:50:19,CryptoCurrency,bitcoin,reddit_post,2025,10,28,reddit_posts_20251028_112145.csv,From outflows to inflows: Bitcoin ETPs rally amid surprising economic update,,https://cointelegraph.com/news/crypto-funds-921-million-inflows-cpi-data-coinshares?utm_source=feedly_feed&utm_medium=rss&utm_campaign=rss_partner_inbound,,6.0,1.0,0.88,1761561592.0,Illperformance6969,"tldr; Cryptocurrency investment products saw a resurgence last week, with $921 million in inflows, reversing the previous week's $513 million outflows. This shift was driven by lower-than-expected US inflation data, which renewed confidence in potential rate cuts. Bitcoin led the inflows with $931 million, recovering prior losses, while Ether experienced outflows for the first time in five weeks. Altcoin ETPs like Solana and XRP saw slower inflows. Total assets under management in crypto funds reached $229 billion, with $48.9 billion in inflows this year.

*This summary is auto generated by a bot and not meant to replace reading the original article. As always, DYOR.",t3_1ohb080,,,,,,,,,,,,,,From outflows to inflows: Bitcoin ETPs rally amid surprising economic update ,positive,0.9384793639183044
nlp004e,1oha8zo,,,2.0,,1761590648.0,2025-10-27T19:44:08,CryptoCurrency,bitcoin,reddit_post,2025,10,28,reddit_posts_20251028_112145.csv,"Bitcoin Extends Rally Above $115,500 as Market Optimism Builds Ahead of Fed Rate Decision","Bitcoin continues its upward trajectory on Monday, trading above  $115,500 as US-China trade relations and expectations of a Federal Reserve cut have lifted investor sentiment and brought optimism in the market. 

Ease in geopolitical risks and softer inflation data have encouraged renewed buying across digital assets.",https://www.gadgets360.com/cryptocurrency/news/crypto-bitcoin-ethereum-ether-btc-eth-market-prices-btc-price-eth-price-crypto-news-today-9523192,,31.0,4.0,0.87,1761558802.0,Green_Candler,TACO will happen and the Pump is inevitable...,t3_1oha8zo,,,,,,,,,,,,,,"Bitcoin Extends Rally Above $115,500 as Market Optimism Builds Ahead of Fed Rate Decision Bitcoin continues its upward trajectory on Monday, trading above  $115,500 as US-China trade relations and expectations of a Federal Reserve cut have lifted investor sentiment and brought optimism in the market. 

Ease in geopolitical risks and softer inflation data have encouraged renewed buying across digital assets.",negative,0.9986273050308228
nlmfgn9,1oha029,,,12.0,,1761558306.0,2025-10-27T10:45:06,CryptoCurrency,bitcoin,reddit_post,2025,10,28,reddit_posts_20251028_112145.csv,‘Attack on Bitcoin’ — Bitcoiners slam ‘legal threats’ in soft fork proposal,,https://cointelegraph.com/news/bitcoin-soft-fork-luke-dashjr-legal-threat-debate,,55.0,75.0,0.86,1761557852.0,GreedVault,"I'm not sure I fully understand the proposal, so I'd like to hear opinions and thoughts on it",t3_1oha029,,,,,,,,,,,,,,‘Attack on Bitcoin’ — Bitcoiners slam ‘legal threats’ in soft fork proposal ,negative,0.9952349066734314
nllftzt,1oh407l,,,6.0,,1761537029.0,2025-10-27T04:50:29,CryptoCurrency,bitcoin,reddit_post,2025,10,28,reddit_posts_20251028_112145.csv,Is there a calculator that can estimate how much you would’ve paid in funding fees on a perp?,"For example, let’s say I opened a 1 BTC 2x long when Bitcoin was $17.1K on January 9, 2023. Assume the position size was 1 BTC.

Then, let’s say I closed it on March 4, 2024, at $64K.

Is there a calculator that can show how much money you would’ve lost to funding fees? 

I know the fee differs between CEXs, but I’d like to assume it’s roughly the same across major ones and that’s good enough. So a calculator for any major exchange, or for average BTC funding fees, would be fine.

Reason: I’m trying to figure out whether small-leverage longs (1.5x–2x) are worth it if they stay open for such a long time.

Thanks in advance!",https://www.reddit.com/r/CryptoCurrency/comments/1oh407l/is_there_a_calculator_that_can_estimate_how_much/,,7.0,5.0,0.74,1761535053.0,NFTbyND,"No, you can't. Perp funding rates fluctuate based on demand and supply. You can't tell what the future funding rates are to make this calculation.",t3_1oh407l,,,,,,,,,,,,,,"Is there a calculator that can estimate how much you would’ve paid in funding fees on a perp? For example, let’s say I opened a 1 BTC 2x long when Bitcoin was $17.1K on January 9, 2023. Assume the position size was 1 BTC.

Then, let’s say I closed it on March 4, 2024, at $64K.

Is there a calculator that can show how much money you would’ve lost to funding fees? 

I know the fee differs between CEXs, but I’d like to assume it’s roughly the same across major ones and that’s good enough. So a calculator for any major exchange, or for average BTC funding fees, would be fine.

Reason: I’m trying to figure out whether small-leverage longs (1.5x–2x) are worth it if they stay open for such a long time.

Thanks in advance!",negative,0.9976285099983215
nlkf13y,1ogzski,,,3.0,,1761523216.0,2025-10-27T01:00:16,CryptoCurrency,bitcoin,reddit_post,2025,10,28,reddit_posts_20251028_112145.csv,Hear me out....,"What if we used our GPU us as inference for sale as if it was a cryptocurrency. As in our proof of work would be inference. And that would be based on a coin that was traded on like bitcoin. The basic idea would be miners would ""sell"" there gpu power for AI, this would be tracked and recorded by the crypto styem, that would assign coins. Than these coins could be traded on the open market as proof of work, as the only way to ge them would be useing your gpu for AI. This would slove part of the energy problem, and would allow nroaml people to lease there gpus for AI nad make money.",https://www.reddit.com/r/CryptoCurrency/comments/1ogzski/hear_me_out/,,0.0,10.0,0.48,1761522772.0,Triconick,Look $jtvo in solana,t3_1ogzski,,,,,,,,,,,,,,"Hear me out.... What if we used our GPU us as inference for sale as if it was a cryptocurrency. As in our proof of work would be inference. And that would be based on a coin that was traded on like bitcoin. The basic idea would be miners would ""sell"" there gpu power for AI, this would be tracked and recorded by the crypto styem, that would assign coins. Than these coins could be traded on the open market as proof of work, as the only way to ge them would be useing your gpu for AI. This would slove part of the energy problem, and would allow nroaml people to lease there gpus for AI nad make money.",negative,0.994077205657959
nlm95x2,1ogwp6f,,,1.0,,1761554313.0,2025-10-27T09:38:33,CryptoCurrency,bitcoin,reddit_post,2025,10,28,reddit_posts_20251028_112145.csv,Can AI fix the human side of crypto governance?,"Bitcoin expert Jimmy Song recently outlined a problem that runs deeper than Bitcoin, one that affects almost every decentralized ecosystem today.

Even in open systems, code often remains centralized. A small group of developers ends up steering direction, while millions of users have little to no real input.

As Song puts it: When developers value different things than users, something has to give. Either you get new developers aligned with users, or users leave.

This is less a technical issue and more a coordination one.
How do you align large, global communities when human consensus doesn’t scale?

Many projects have tried to solve this through voting based governance, but that approach has serious flaws:

1. Code proposals are too complex for most users to evaluate.

2. Voting doesn’t scale, who decides what gets voted on?

3.Hierarchies and political dynamics inevitably form.

4. Expression gets reduced to binary “yes/no” inputs that miss nuance.

In short, even decentralized systems can fall into centralized coordination traps.

Recently, some new approaches have started emerging. One of them from Tau Net, led by Ohad Asor takes a very different route. Instead of relying on voting, it uses a logical AI system that interprets what users mean (in computable language), maps out areas of agreement and conflict and then derives consensus automatically.

Whether or not this specific model succeeds, it raises an important question. 
Can we build governance mechanisms that reflect what communities actually think and want without depending on hierarchy, politics, or mass voting?

It feels like this might be the next frontier for crypto, solving the human side of decentralization.

Is something like this the natural evolution of decentralized governance, or is true user-controlled consensus still a pipe dream?",https://www.reddit.com/r/CryptoCurrency/comments/1ogwp6f/can_ai_fix_the_human_side_of_crypto_governance/,,0.0,1.0,0.14,1761514569.0,Omegacarlos1,AI can not fix the human side of crypto governance,t3_1ogwp6f,,,,,,,,,,,,,,"Can AI fix the human side of crypto governance? Bitcoin expert Jimmy Song recently outlined a problem that runs deeper than Bitcoin, one that affects almost every decentralized ecosystem today.

Even in open systems, code often remains centralized. A small group of developers ends up steering direction, while millions of users have little to no real input.

As Song puts it: When developers value different things than users, something has to give. Either you get new developers aligned with users, or users leave.

This is less a technical issue and more a coordination one.
How do you align large, global communities when human consensus doesn’t scale?

Many projects have tried to solve this through voting based governance, but that approach has serious flaws:

1. Code proposals are too complex for most users to evaluate.

2. Voting doesn’t scale, who decides what gets voted on?

3.Hierarchies and political dynamics inevitably form.

4. Expression gets reduced to binary “yes/no” inputs that miss nuance.

In short, even decentralized systems can fall into centralized coordination traps.

Recently, some new approaches have started emerging. One of them from Tau Net, led by Ohad Asor takes a very different route. Instead of relying on voting, it uses a logical AI system that interprets what users mean (in computable language), maps out areas of agreement and conflict and then derives consensus automatically.

Whether or not this specific model succeeds, it raises an important question. 
Can we build governance mechanisms that reflect what communities actually think and want without depending on hierarchy, politics, or mass voting?

It feels like this might be the next frontier for crypto, solving the human side of decentralization.

Is something like this the natural evolution of decentralized governance, or is true user-controlled consensus still a pipe dream?",negative,0.9969403743743896
