,1oqnyur,,,,,,2025-11-07T07:20:54,CryptoCurrency,bitcoin OR ethereum,reddit_post,2025,11,24,reddit_posts_20251124.csv,Ethereum traders flip bullish as rest of market remains fearful,,https://cointelegraph.com/news/ethereum-traders-bullish-when-eth-neared-3500,DryMyBottom,4.0,1.0,0.57,1762500054.0,,,,,,,,,,,,,,,,,Ethereum traders flip bullish as rest of market remains fearful ,positive,0.8299025893211365
,1p5or9t,,,,,,2025-11-24T18:22:06,CryptoCurrency,bitcoin OR ethereum,reddit_post,2025,11,24,reddit_posts_20251124.csv,"Largest Ethereum treasury BitMine invests another $200 million, addresses recent ETH price decline",,https://www.theblock.co/post/380159/largest-ethereum-treasury-bitmine-invests-another-200-million-addresses-recent-eth-price-decline,Odd-Radio-8500,4.0,1.0,1.0,1764008526.0,,,,,,,,,,,,,,,,,"Largest Ethereum treasury BitMine invests another $200 million, addresses recent ETH price decline ",negative,0.9252822399139404
,1p5qtty,,,,,,2025-11-24T19:38:12,CryptoCurrency,bitcoin OR ethereum,reddit_post,2025,11,24,reddit_posts_20251124.csv,Bitcoin rises to $88K as Trump’s Xi call fuels optimism across markets,,https://cryptobriefing.com/bitcoin-breaks-88000-milestone/,KIG45,182.0,37.0,0.88,1764013092.0,,,,,,,,,,,,,,,,,Bitcoin rises to $88K as Trump’s Xi call fuels optimism across markets ,negative,0.9975913763046265
,1p7jra5,,,,,,2025-11-26T21:15:49,CryptoCurrency,bitcoin OR ethereum,reddit_post,2025,11,25,reddit_posts_20251125.csv,"Peter Schiff Says Bitcoin, Ethereum Treasury Companies Have 'No Viable Business Model'",,https://www.benzinga.com/crypto/cryptocurrency/25/11/49093635/peter-schiff-says-bitcoin-ethereum-treasury-companies-have-no-viable-business-model,partymsl,0.0,1.0,0.5,1764191749.0,,,,,,,,,,,,,,,,,"Peter Schiff Says Bitcoin, Ethereum Treasury Companies Have 'No Viable Business Model' ",negative,0.9736875295639038
,1p7jiw4,,,,,,2025-11-26T21:06:51,CryptoCurrency,bitcoin OR ethereum,reddit_post,2025,11,25,reddit_posts_20251125.csv,Texas advances state-level Bitcoin reserve with BlackRock investment,,https://crypto.news/texas-advances-state-level-bitcoin-reserve-with-blackrock-investment/,goldyluckinblokchain,3.0,0.0,1.0,1764191211.0,,,,,,,,,,,,,,,,,Texas advances state-level Bitcoin reserve with BlackRock investment ,negative,0.9992233514785767
,1p7ijnh,,,,,,2025-11-26T20:28:01,CryptoCurrency,bitcoin OR ethereum,reddit_post,2025,11,25,reddit_posts_20251125.csv,"Bitcoin Reclaims $90K Ahead of Thanksgiving as Ethereum, XRP Bounce Back",,https://decrypt.co/350151/bitcoin-reclaims-90k-ahead-thanksgiving-ethereum-xrp-bounce-back,kirtash93,31.0,12.0,0.94,1764188881.0,,,,,,,,,,,,,,,,,"Bitcoin Reclaims $90K Ahead of Thanksgiving as Ethereum, XRP Bounce Back ",negative,0.999431312084198
,1p7bcqx,,,,,,2025-11-26T15:57:06,CryptoCurrency,bitcoin OR ethereum,reddit_post,2025,11,25,reddit_posts_20251125.csv,"Texas Drops $10 Million On Bitcoin, Officially Buying The Dip First",,https://www.newsbtc.com/news/bitcoin/texas-drops-10-million-on-bitcoin-officially-buying-the-dip-first/,KIG45,370.0,44.0,0.95,1764172626.0,,,,,,,,,,,,,,,,,"Texas Drops $10 Million On Bitcoin, Officially Buying The Dip First ",negative,0.9866266846656799
,1p7bck9,,,,,,2025-11-26T15:56:55,CryptoCurrency,bitcoin OR ethereum,reddit_post,2025,11,25,reddit_posts_20251125.csv,Tether’s USDT stability score cut to 'weak' level as S&P says reserves can’t absorb bitcoin drop,,https://www.theblock.co/post/380562/tether-usdt-stability-score-weak-sp-reserves-cant-absorb-bitcoin-drop?utm_source=telegram1&utm_medium=social,KazuFromUniswap,43.0,38.0,0.84,1764172615.0,,,,,,,,,,,,,,,,,Tether’s USDT stability score cut to 'weak' level as S&P says reserves can’t absorb bitcoin drop ,positive,0.9905394315719604
,1p72r6g,,,,,,2025-11-26T08:42:04,CryptoCurrency,bitcoin OR ethereum,reddit_post,2025,11,25,reddit_posts_20251125.csv,The Great State of Texas Acquires Bitcoin,,https://i.redd.it/ni68clkgog3g1.jpeg,CriticalCobraz,52.0,35.0,0.73,1764146524.0,,,,,,,,,,,,,,,,,The Great State of Texas Acquires Bitcoin ,negative,0.9833987951278687
,1p71qx6,,,,,,2025-11-26T07:38:04,CryptoCurrency,bitcoin OR ethereum,reddit_post,2025,11,25,reddit_posts_20251125.csv,BlackRock dumps more Bitcoin despite BTC recovery,,https://finbold.com/blackrock-dumps-more-bitcoin-despite-btc-recovery/,Abdeliq,157.0,68.0,0.7,1764142684.0,,,,,,,,,,,,,,,,,BlackRock dumps more Bitcoin despite BTC recovery ,positive,0.9582478404045105
,1p71mer,,,,,,2025-11-26T07:30:09,CryptoCurrency,bitcoin OR ethereum,reddit_post,2025,11,25,reddit_posts_20251125.csv,Bitcoin Is Math Money,Source: [https://x.com/BitcoinArchive/status/1993338849867563503](https://x.com/BitcoinArchive/status/1993338849867563503),https://www.reddit.com/gallery/1p71mer,kirtash93,0.0,14.0,0.47,1764142209.0,,,,,,,,,,,,,,,,,Bitcoin Is Math Money Source: [https://x.com/BitcoinArchive/status/1993338849867563503](https://x.com/BitcoinArchive/status/1993338849867563503),positive,0.8815997838973999
,1p6yq8c,,,,,,2025-11-26T04:46:00,CryptoCurrency,bitcoin OR ethereum,reddit_post,2025,11,25,reddit_posts_20251125.csv,Inside the JPMorgan boycott drama defending Bitcoin treasuries being kicked off major indexes,,https://cryptoslate.com/inside-the-jpmorgan-boycott-drama-to-defend-strategys-inclusion-in-major-indexes/,DirectionMundane5468,49.0,8.0,0.87,1764132360.0,,,,,,,,,,,,,,,,,Inside the JPMorgan boycott drama defending Bitcoin treasuries being kicked off major indexes ,positive,0.9923436045646667
,1p6ypp2,,,,,,2025-11-26T04:45:13,CryptoCurrency,bitcoin OR ethereum,reddit_post,2025,11,25,reddit_posts_20251125.csv,Kraken Launches Bitcoin Rewards Debit Mastercard Ahead of Planned IPO,,https://decrypt.co/news-explorer?pinned=1242296&title=kraken-serves-up-bitcoin-rewards-with-krak-debit-mastercard,DirectionMundane5468,27.0,4.0,0.89,1764132313.0,,,,,,,,,,,,,,,,,Kraken Launches Bitcoin Rewards Debit Mastercard Ahead of Planned IPO ,negative,0.9981940388679504
,1p6spzt,,,,,,2025-11-25T23:57:56,CryptoCurrency,bitcoin OR ethereum,reddit_post,2025,11,25,reddit_posts_20251125.csv,"Ethereum Foundation unveils Interop Layer (EIL) which aims to make all L2s feel like a single, unified Ethereum Chain Again",,https://www.cryptopolitan.com/texas-make-history-as-first-bitcoin-purchase/,CriticalCobraz,99.0,22.0,0.86,1764115076.0,,,,,,,,,,,,,,,,,"Ethereum Foundation unveils Interop Layer (EIL) which aims to make all L2s feel like a single, unified Ethereum Chain Again ",positive,0.9808527827262878
,1p6qr3h,,,,,,2025-11-25T22:33:55,CryptoCurrency,bitcoin OR ethereum,reddit_post,2025,11,25,reddit_posts_20251125.csv,"10 years of crypto journey, but I am quitting.","Ten years in crypto have been quite a journey. I remember how hard it was to find quality content about crypto back then, when most of the material was still about earning free bitcoin faucets and anarcho-capitalists talking about bitcoin’s future.

There were only a few exchanges and most didn’t even require KYC. Altcoins were this hazy thing, you had to download the wallet to your PC and often the whole blockchain just to store your little coins. It was fun and innovative.

Ethereum started to take off in 2017 and smart contracts began pulling crypto out of the prehistoric era. An ICO here, another one there, tokens were being listed on exchanges with ridiculous pumps, suddenly everyone wanted a piece of the pie and ICOs started crawling out of the gutter.

Masternodes, PoS coins, smart contracts, hard forks with miners and idealists still trying to be the lords of bitcoin. Bitcoin was still viewed with huge distrust by small investors, but that didn’t stop it from making the most memorable rally, going from 600 dollars in September 2016 to almost 20k in December 2017. It felt like the revolution of the century.

Then came the long winter in 2018. Bitcoin dropped more than 80 percent, but it was a pretty normal bear-market correction, maybe boosted by the frenzy of greedy and failed ICOs.

It took until the covid crash for the market to heat up again. The amount of money injected into the economy was insane. For a brief moment it felt like there were fewer projects than there was demand. It started with DeFi, the rise of DEXes, governance tokens and generous airdrops. For me that was the best moment in crypto, between 2020 and 2021. But as 2021 went on, the exuberance went way overboard. Crypto went mainstream with celebrities, meme coins, blockchain games, NFTs costing almost as much as a yacht, and ponzi schemes like Luna and FTX popping up and somehow reaching absurd valuations.

In 2022 reality hit hard and crypto collapsed like never before. Losses and bankruptcies were everywhere. BTC fell below its 2017 peak again and a lot of inexperienced investors who got caught in the hype the year before were wiped out. Even stablecoins were under extreme distrust. I remember coworkers asking for help with Metamask and buying NFTs, that was the ultimate bubble signal. These people will never come back to crypto, and who could blame them? Even experienced investors lost fortunes.

Then 2024 arrived and thanks to the first bitcoin spot ETF prices went up quickly, even before the halving cycle. It was the bitcoin dominance cycle. Only a few selected altcoins went up and those crazy altseasons were left behind. Even with a pro-crypto president the market didn’t heat up, the mood of distrust and resentment was still there. Any sign of buying or innovation that used to look like a game changer and a promising opportunity started to be seen as a scam. Controversial listings on big exchanges, insiders dumping, tokens that seemed created only to benefit a tiny group of sharks with no real value. There are way more tokens than the current cautious and selective demand can handle, barely any liquidity. I think even serious projects got hit by this paranoia and never took off.

My view is that crypto lost a big part of the ideology that made it interesting. For you to download an entire blockchain and store your little coins, someone had to really believe in that thing. There was an idea behind it, something that didn’t involve venture-capital money, shady insider allocations, or quick profits from futures trading. Crypto turned into pure speculation. Everything is easy now. A project appears and it’s already listed for derivatives trading, and people don’t care about anything else. They just see it drop 50 percent in a week and nobody wants it anymore. The promise of more liquidity came at a high price, with clueless investors and vultures who robbed and keep robbing the space.

Crypto turned into just trading, empty and random, nothing behind it, fast gains and goodbye. At least with stocks you can see some backing, results, profits, a business to evaluate. With crypto we are longing and shorting hot air without any real contact with the technology. Crypto is technology. It shouldn’t be just a TradingView chart. In the end crypto became and solidified itself as inferior to the stock market.

AI stocks are tied to products you actually use daily. Health-care stocks influence what you pay at the pharmacy. Defense stocks shape where a big chunk of taxpayer money goes.

Crypto is just money speculating on itself. There’s no substantial innovation anymore, nobody gets excited about using a smart contract or downloading a new wallet and appreciating a protocol’s tech. I still have my Monero wallet here in the old-school way, but one of the few coins that actually fulfills a real use case ends up banned from exchanges, and that says a lot.

**Unfortunately I don’t see much of a future anymore. For all the reasons I mentioned, both financially and in terms of real innovation, the stock market has become way more interesting to follow and, to some degree, safer to invest in. That’s why I’m cashing out of crypto. I think it already served its purpose and its best days are behind it for good.** ",https://www.reddit.com/r/CryptoCurrency/comments/1p6qr3h/10_years_of_crypto_journey_but_i_am_quitting/,pedronegreiros94,620.0,416.0,0.79,1764110035.0,,,,,,,,,,,,,,,,,"10 years of crypto journey, but I am quitting. Ten years in crypto have been quite a journey. I remember how hard it was to find quality content about crypto back then, when most of the material was still about earning free bitcoin faucets and anarcho-capitalists talking about bitcoin’s future.

There were only a few exchanges and most didn’t even require KYC. Altcoins were this hazy thing, you had to download the wallet to your PC and often the whole blockchain just to store your little coins. It was fun and innovative.

Ethereum started to take off in 2017 and smart contracts began pulling crypto out of the prehistoric era. An ICO here, another one there, tokens were being listed on exchanges with ridiculous pumps, suddenly everyone wanted a piece of the pie and ICOs started crawling out of the gutter.

Masternodes, PoS coins, smart contracts, hard forks with miners and idealists still trying to be the lords of bitcoin. Bitcoin was still viewed with huge distrust by small investors, but that didn’t stop it from making the most memorable rally, going from 600 dollars in September 2016 to almost 20k in December 2017. It felt like the revolution of the century.

Then came the long winter in 2018. Bitcoin dropped more than 80 percent, but it was a pretty normal bear-market correction, maybe boosted by the frenzy of greedy and failed ICOs.

It took until the covid crash for the market to heat up again. The amount of money injected into the economy was insane. For a brief moment it felt like there were fewer projects than there was demand. It started with DeFi, the rise of DEXes, governance tokens and generous airdrops. For me that was the best moment in crypto, between 2020 and 2021. But as 2021 went on, the exuberance went way overboard. Crypto went mainstream with celebrities, meme coins, blockchain games, NFTs costing almost as much as a yacht, and ponzi schemes like Luna and FTX popping up and somehow reaching absurd valuations.

In 2022 reality hit hard and crypto collapsed like never before. Losses and bankruptcies were everywhere. BTC fell below its 2017 peak again and a lot of inexperienced investors who got caught in the hype the year before were wiped out. Even stablecoins were under extreme distrust. I remember coworkers asking for help with Metamask and buying NFTs, that was the ultimate bubble signal. These people will never come back to crypto, and who could blame them? Even experienced investors lost fortunes.

Then 2024 arrived and thanks to the first bitcoin spot ETF prices went up quickly, even before the halving cycle. It was the bitcoin dominance cycle. Only a few selected altcoins went up and those crazy altseasons were left behind. Even with a pro-crypto president the market didn’t heat up, the mood of distrust and resentment was still there. Any sign of buying or innovation that used to look like a game changer and a promising opportunity started to be seen as a scam. Controversial listings on big exchanges, insiders dumping, tokens that seemed created only to benefit a tiny group of sharks with no real value. There are way more tokens than the current cautious and selective demand can handle, barely any liquidity. I think even serious projects got hit by this paranoia and never took off.

My view is that crypto lost a big part of the ideology that made it interesting. For you to download an entire blockchain and store your little coins, someone had to really believe in that thing. There was an idea behind it, something that didn’t involve venture-capital money, shady insider allocations, or quick profits from futures trading. Crypto turned into pure speculation. Everything is easy now. A project appears and it’s already listed for derivatives trading, and people don’t care about anything else. They just see it drop 50 percent in a week and nobody wants it anymore. The promise of more liquidity came at a high price, with clueless investors and vultures who robbed and keep robbing the space.

Crypto turned into just trading, empty and random, nothing behind it, fast gains and goodbye. At least with stocks you can see some backing, results, profits, a business to evaluate. With crypto we are longing and shorting hot air without any real contact with the technology. Crypto is technology. It shouldn’t be just a TradingView chart. In the end crypto became and solidified itself as inferior to the stock market.

AI stocks are tied to products you actually use daily. Health-care stocks influence what you pay at the pharmacy. Defense stocks shape where a big chunk of taxpayer money goes.

Crypto is just money speculating on itself. There’s no substantial innovation anymore, nobody gets excited about using a smart contract or downloading a new wallet and appreciating a protocol’s tech. I still have my Monero wallet here in the old-school way, but one of the few coins that actually fulfills a real use case ends up banned from exchanges, and that says a lot.

**Unfortunately I don’t see much of a future anymore. For all the reasons I mentioned, both financially and in terms of real innovation, the stock market has become way more interesting to follow and, to some degree, safer to invest in. That’s why I’m cashing out of crypto. I think it already served its purpose and its best days are behind it for good.** ",negative,0.9341004490852356
,1p6qaaa,,,,,,2025-11-25T22:15:11,CryptoCurrency,bitcoin OR ethereum,reddit_post,2025,11,25,reddit_posts_20251125.csv,Bitcoin wavers under $88K as traders brace for $14B BTC options expiry,,https://cointelegraph.com/news/bitcoin-wavers-under-dollar88k-as-dollar14b-btc-options-expiry-draws-near,Abdeliq,256.0,14.0,0.93,1764108911.0,,,,,,,,,,,,,,,,,Bitcoin wavers under $88K as traders brace for $14B BTC options expiry ,positive,0.982611358165741
,1p6khno,,,,,,2025-11-25T18:37:10,CryptoCurrency,bitcoin OR ethereum,reddit_post,2025,11,25,reddit_posts_20251125.csv,We're saved...,,https://i.redd.it/vomegarl6g3g1.png,Odd-Radio-8500,1163.0,26.0,0.96,1764095830.0,,,,,,,,,,,,,,,,,We're saved... ,negative,0.9201616048812866
,1p6kdaz,,,,,,2025-11-25T18:32:44,CryptoCurrency,bitcoin OR ethereum,reddit_post,2025,11,25,reddit_posts_20251125.csv,Over 8% of all Bitcoin just changed hands in a week - markets on a knife's edge waiting for Fed decision,"So something historically significant just happened. More than 8% of Bitcoins entire supply changed hands over the past seven days. Joe Burnett from Semler Scientific called this one of the most significant onchain events in Bitcoin history.

The last times we saw supply movements this large were in March 2020 when BTC was around 5000 dollars and December 2018 when it hit 3500. Both of those marked local bottoms before accumulation phases that eventually led to new all time highs. So historically this type of activity has been bullish longterm.

Theres a catch tho. Up to half of this movement might just be from Coinbase doing a wallet migration they announced on Saturday. So the actual selling and buying pressure might be less dramatic than the raw numbers suggest.

Right now the markets completely focused on what the Fed does on December 10th. Odds of a 25 basis point rate cut jumped from 50% to 82% in just a week according to CME Groups FedWatch tool. Thats whats fueling Bitcoins recovery from 81k back to 87k.

Nic Puckrin from Coin Bureau put it pretty well saying were on a knifes edge and the Fed holds the key to whether we get a Santa rally or a Santa dump. As we get closer to December 10th expect volatility to pick up even more.

The mixed messages about rate cuts are keeping everyone on edge. Markets jitters are gonna continue until we actually get clarity from the Feds press conference. Basically everyones just waiting to see what Jerome Powell says before making any big moves.",https://www.reddit.com/r/CryptoCurrency/comments/1p6kdaz/over_8_of_all_bitcoin_just_changed_hands_in_a/,Gullible-Tale9114,1.0,3.0,0.52,1764095564.0,,,,,,,,,,,,,,,,,"Over 8% of all Bitcoin just changed hands in a week - markets on a knife's edge waiting for Fed decision So something historically significant just happened. More than 8% of Bitcoins entire supply changed hands over the past seven days. Joe Burnett from Semler Scientific called this one of the most significant onchain events in Bitcoin history.

The last times we saw supply movements this large were in March 2020 when BTC was around 5000 dollars and December 2018 when it hit 3500. Both of those marked local bottoms before accumulation phases that eventually led to new all time highs. So historically this type of activity has been bullish longterm.

Theres a catch tho. Up to half of this movement might just be from Coinbase doing a wallet migration they announced on Saturday. So the actual selling and buying pressure might be less dramatic than the raw numbers suggest.

Right now the markets completely focused on what the Fed does on December 10th. Odds of a 25 basis point rate cut jumped from 50% to 82% in just a week according to CME Groups FedWatch tool. Thats whats fueling Bitcoins recovery from 81k back to 87k.

Nic Puckrin from Coin Bureau put it pretty well saying were on a knifes edge and the Fed holds the key to whether we get a Santa rally or a Santa dump. As we get closer to December 10th expect volatility to pick up even more.

The mixed messages about rate cuts are keeping everyone on edge. Markets jitters are gonna continue until we actually get clarity from the Feds press conference. Basically everyones just waiting to see what Jerome Powell says before making any big moves.",positive,0.9368876218795776
