nlt30h6,1oi5oxi,,,5.0,,1761649176.0,2025-10-28T11:59:36,CryptoCurrency,bitcoin,reddit_post,2025,10,28,reddit_posts_20251028_135711.csv,"Post Quantum Panic - new research and accelerating timeline, in all likelyhood we have less tine than we thought","The guy is a known expert. Worth a watch, it's sufficiently laymen. It pays to pay attention to the accelerating timeline and to stop acting dismissively.

I also liked his remark about IBM never having missed a deadline, and how he uses IBM's timeline as the most conservative estimate.

In the meantime, keep buying Bitcoin.

Traditionally crypto enthusiasts have been responding with ""The world will have much bigger problems if RSA or ECC is cracked."" which is funny when you think about it, because out of all the big & high stake systems you could attack,  a crypto network would likely be one of the first, simply because attacking other big & high stake systems has a higher risk of sending you to jail. In other words, the other big systems have an inherent higher level of protection.

P.S. Bitcoin MODs: you're hurting your own community, and your message to me says more about you. Banning me from r/Bitcoin for posting this video with ""you're obviously not here to learn about bitcoin"" is ironic, given the video is meant to help people learn. My almost 10 years of advocating and speaking for bitcon doesn't count, a ban is quicker than looking up my post hisotry about Bitcoin.",https://youtu.be/OkVYJx1iLNs,,0.0,17.0,0.44,1761647237.0,johnfintech,"Doesn't NIST already have recommendations for quantum proof signatures schemes so it's just a consensus hurdle to implement them, not technical?",t3_1oi5oxi,,,,,,,,,,,,,,"Post Quantum Panic - new research and accelerating timeline, in all likelyhood we have less tine than we thought The guy is a known expert. Worth a watch, it's sufficiently laymen. It pays to pay attention to the accelerating timeline and to stop acting dismissively.

I also liked his remark about IBM never having missed a deadline, and how he uses IBM's timeline as the most conservative estimate.

In the meantime, keep buying Bitcoin.

Traditionally crypto enthusiasts have been responding with ""The world will have much bigger problems if RSA or ECC is cracked."" which is funny when you think about it, because out of all the big & high stake systems you could attack,  a crypto network would likely be one of the first, simply because attacking other big & high stake systems has a higher risk of sending you to jail. In other words, the other big systems have an inherent higher level of protection.

P.S. Bitcoin MODs: you're hurting your own community, and your message to me says more about you. Banning me from r/Bitcoin for posting this video with ""you're obviously not here to learn about bitcoin"" is ironic, given the video is meant to help people learn. My almost 10 years of advocating and speaking for bitcon doesn't count, a ban is quicker than looking up my post hisotry about Bitcoin.",positive,0.9532670378684998
nlz22qh,1oiyq9d,,,4.0,,1761725686.0,2025-10-29T09:14:46,CryptoCurrency,bitcoin,reddit_post,2025,10,29,reddit_posts_20251029.csv,"Bitcoin Holds $113K as Liquidity Thins, Traders Turn Defensive Before Fed Week",,https://www.coindesk.com/markets/2025/10/29/bitcoin-holds-usd113k-as-liquidity-thins-traders-turn-defensive-before-fed-week,,10.0,3.0,0.86,1761725410.0,DryMyBottom,No one turns defensive it's just Trumps family and CZ pulling shut again,t3_1oiyq9d,,,,,,,,,,,,,,"Bitcoin Holds $113K as Liquidity Thins, Traders Turn Defensive Before Fed Week ",negative,0.8640464544296265
nlyx4qf,1oixxrx,,,4.0,,1761722570.0,2025-10-29T08:22:50,CryptoCurrency,bitcoin,reddit_post,2025,10,29,reddit_posts_20251029.csv,"Bitcoin Doesn't Promise Comfort. It Promises Escape. The escape is not a single event. It is a process. It is the process of learning, of taking responsibility, of slowly, transaction by transaction, moving your life-force from their system to this one.",,https://inbitcoinwetrust.substack.com/p/bitcoin-doesnt-promise-comfort-it,,0.0,8.0,0.48,1761722124.0,sylsau,">The escape is not a single event. It is a process.

  
go tell this to degens entering the crypto space investing with leverage on memecoins for 100x returns to be made in less than a day 😅",t3_1oixxrx,,,,,,,,,,,,,,"Bitcoin Doesn't Promise Comfort. It Promises Escape. The escape is not a single event. It is a process. It is the process of learning, of taking responsibility, of slowly, transaction by transaction, moving your life-force from their system to this one. ",negative,0.8335496783256531
