subreddit,post_id,title,author,created_utc,score,upvote_ratio,num_comments,url,permalink,selftext,link_flair_text,is_self,distinguished,stickied
bitcoin,1o7jnsb,You know what to do,TheUnholyMoly,2025-10-15T19:51:50,1406,0.97,239,https://i.redd.it/jy2cdqzunbvf1.jpeg,https://reddit.com/r/Bitcoin/comments/1o7jnsb/you_know_what_to_do/,,,False,,False
bitcoin,1ocfagp,Investors do not yet know which is good👍😅😉,Same-Abroad-993,2025-10-21T16:00:35,1403,0.95,51,https://i.redd.it/1i1hmrd2chwf1.jpeg,https://reddit.com/r/Bitcoin/comments/1ocfagp/investors_do_not_yet_know_which_is_good/,,,False,,False
bitcoin,1nygv8c,"$125,000 BTC",bitcoin-machinegun,2025-10-05T07:29:56,1354,0.99,34,https://i.redd.it/ka123dpdm8tf1.gif,https://reddit.com/r/Bitcoin/comments/1nygv8c/125000_btc/,I guess it’s safe to use this GIF? 😂🤟,,False,,False
bitcoin,1o3kr75,Today’s dip really taught me something…,TopComprehensive4016,2025-10-11T04:02:11,1325,0.91,530,https://www.reddit.com/r/Bitcoin/comments/1o3kr75/todays_dip_really_taught_me_something/,https://reddit.com/r/Bitcoin/comments/1o3kr75/todays_dip_really_taught_me_something/,"Most of the people in here don’t actually believe in Bitcoin. They’re just worried about their money. Bitcoin fell almost 20% at one point today. Your reaction should be either:

1. Who cares, it’ll eventually go up. 
2. Great, I’ll buy more.

Anything other than that and you’re not fit to “invest” in Bitcoin. ",,True,,False
bitcoin,1nzljst,Bitcoin is up over 500% since Justin Trudeau said anyone who bought Bitcoin would have lost more than half their life savings. 👀,Fiach_Dubh,2025-10-06T16:04:09,1314,0.95,185,https://v.redd.it/26o2pp0xcbtf1,https://reddit.com/r/Bitcoin/comments/1nzljst/bitcoin_is_up_over_500_since_justin_trudeau_said/,,,False,,False
bitcoin,1nv31ft,What a nice way to start Uptober,Rez_X_RS,2025-10-01T09:52:21,1292,0.95,87,https://i.redd.it/niv90275sgsf1.jpeg,https://reddit.com/r/Bitcoin/comments/1nv31ft/what_a_nice_way_to_start_uptober/,,,False,,False
bitcoin,1odzq7c,38000000000000,HealthyMolasses8199,2025-10-23T11:30:01,1285,0.99,105,https://v.redd.it/ejs6i6tg9uwf1,https://reddit.com/r/Bitcoin/comments/1odzq7c/38000000000000/,,,False,,False
bitcoin,1o76zl8,It's not much but it's a start,harmfulvisitor,2025-10-15T11:08:26,1285,0.97,79,https://i.redd.it/6lk6yu7h29vf1.png,https://reddit.com/r/Bitcoin/comments/1o76zl8/its_not_much_but_its_a_start/,,,False,,False
bitcoin,1nwdmrn,Bitcoin is up 100% in 1 year,zeeshiscanning,2025-10-02T20:37:06,1247,0.98,56,https://i.redd.it/l2tmcuw24rsf1.png,https://reddit.com/r/Bitcoin/comments/1nwdmrn/bitcoin_is_up_100_in_1_year/,,,False,,False
bitcoin,1o4mmoa,Lmao,Individual-Canary809,2025-10-12T12:27:42,1201,0.97,39,https://v.redd.it/3yhebuov1ouf1,https://reddit.com/r/Bitcoin/comments/1o4mmoa/lmao/,,,False,,False
bitcoin,1od7id5,Feeling old yet?,unthocks,2025-10-22T13:55:48,1199,0.98,54,https://i.redd.it/7w1azwupunwf1.jpeg,https://reddit.com/r/Bitcoin/comments/1od7id5/feeling_old_yet/,,,False,,False
bitcoin,1ogkt0s,Graffiti in Paris,CW8_Fan,2025-10-26T14:36:42,1183,0.99,21,https://i.redd.it/hxjw50wnlgxf1.jpeg,https://reddit.com/r/Bitcoin/comments/1ogkt0s/graffiti_in_paris/,,,False,,False
bitcoin,1o7b0fs,Found these in my very old wallet,Character-Delay520,2025-10-15T14:28:31,1167,0.96,134,https://i.redd.it/0e3rj1a62avf1.png,https://reddit.com/r/Bitcoin/comments/1o7b0fs/found_these_in_my_very_old_wallet/,I am grateful for my younger self. I am a satoshi millionaire ,,False,,False
bitcoin,1o66quw,BlackRock keeps buying what we sell.,ourcryptotalk,2025-10-14T06:09:41,1168,0.91,146,https://i.redd.it/gnd3z9m1g0vf1.png,https://reddit.com/r/Bitcoin/comments/1o66quw/blackrock_keeps_buying_what_we_sell/,"Bitcoin was meant for decentralization and power in the hands of the people.

But right now, governments and institutions are playing us like a fiddle. BlackRock making buys after buys and retail selling. 

We need to balance this out guys. DON""T SELL.",,False,,False
bitcoin,1o8z78i,octobear,daviddlaid,2025-10-17T12:52:07,1168,0.98,25,https://i.redd.it/2kmgzspsunvf1.jpeg,https://reddit.com/r/Bitcoin/comments/1o8z78i/octobear/,,,False,,False
bitcoin,1ob6y01,Why would you sell BTC?!,Inevitable_Emu_5353,2025-10-20T02:23:03,1169,0.93,136,https://i.redd.it/sduph0va56wf1.jpeg,https://reddit.com/r/Bitcoin/comments/1ob6y01/why_would_you_sell_btc/,,,False,,False
bitcoin,1nw4hyv,"Gov can shut down, Bitcoin uptime is 99.99%",Kazgarth_,2025-10-02T14:56:40,1157,0.95,60,https://i.redd.it/0gay2hobfpsf1.jpeg,https://reddit.com/r/Bitcoin/comments/1nw4hyv/gov_can_shut_down_bitcoin_uptime_is_9999/,,,False,,False
bitcoin,1o94out,So everyone is panicking… because of that?! 😂,Nickylarson73,2025-10-17T16:38:36,1146,0.95,272,https://i.redd.it/8rl5fce7zovf1.jpeg,https://reddit.com/r/Bitcoin/comments/1o94out/so_everyone_is_panicking_because_of_that/,"When I read some defeatist posts this week, I seriously wonder where these people were before 2025 to panic like that...

You bought at the ATH and now you discover that the curves also go down? 😅

I'm still new to investing, but the number 1 rule I've learned: never invest with your emotions.

Breathe. DCA. And stop screaming about crash as soon as the candle changes color. 📉➡️📈

Personally, I do my shopping like a Black Friday — keeping a little cash aside, because it’s clearly not over. 💸",,False,,False
bitcoin,1o4fovk,Spot on,[deleted],2025-10-12T05:18:31,1150,0.98,32,https://i.redd.it/ljjgvzdbxluf1.jpeg,https://reddit.com/r/Bitcoin/comments/1o4fovk/spot_on/,,,False,,False
bitcoin,1o12x2f,It has taken the United States 100 years to do what Rome did in 250 years  regarding their currency devaluation.,Obvireal,2025-10-08T07:21:57,1140,0.95,124,https://i.redd.it/rhvcb7yozttf1.jpeg,https://reddit.com/r/Bitcoin/comments/1o12x2f/it_has_taken_the_united_states_100_years_to_do/,,,False,,False
bitcoin,1oikytc,Buy more $BTC,Available_Reveal4066,2025-10-28T21:46:45,1115,0.96,489,https://i.redd.it/xw76x1p60xxf1.png,https://reddit.com/r/Bitcoin/comments/1oikytc/buy_more_btc/,,,False,,False
bitcoin,1nvdh08,Happy Uptober,rtmxavi,2025-10-01T17:47:34,1097,0.98,20,https://i.redd.it/jr8odtex4jsf1.jpeg,https://reddit.com/r/Bitcoin/comments/1nvdh08/happy_uptober/,,,False,,False
bitcoin,1o0mmqr,10 years ago I made these threads about buying 85 Bitcoin with my $20k student line of credit instead of going to College and everyone ridiculed me. It worked out for me back then but here’s why I wouldn’t recommend buying btc on credit today.,KidEliteTrader,2025-10-07T19:16:38,1084,0.93,229,https://www.reddit.com/r/Bitcoin/comments/1o0mmqr/10_years_ago_i_made_these_threads_about_buying_85/,https://reddit.com/r/Bitcoin/comments/1o0mmqr/10_years_ago_i_made_these_threads_about_buying_85/,"Here's some threads from 10 years ago about me buying 85 btc on my $20k student line of credit instead of going to college: 1. [https://www.reddit.com/r/wallstreetbets/comments/353bqa/personal\_finance\_hating\_on\_my\_20000\_student\_line/](https://www.reddit.com/r/wallstreetbets/comments/353bqa/personal_finance_hating_on_my_20000_student_line/) 2. [https://www.reddit.com/r/wallstreetbets/comments/35cc6y/up\_800\_since\_2\_days\_ago\_since\_rpersonalfinance/](https://www.reddit.com/r/wallstreetbets/comments/35cc6y/up_800_since_2_days_ago_since_rpersonalfinance/) 3. [https://www.reddit.com/r/wallstreetbets/comments/3fwz62/rpersonalfinance\_rwallstreetbets\_and\_most\_of/](https://www.reddit.com/r/wallstreetbets/comments/3fwz62/rpersonalfinance_rwallstreetbets_and_most_of/)

Couldn't post all the threads because automod removed my post when I do but you can check my profile and look at my oldest posts to see them. And there was more threads but lots of them got removed by mods and I got ""kicked out"" from some subs as well, that's how much people were against this back then.

I'm seeing a lot of posts lately from people asking about buying Bitcoin on credit. In 2015 when I just turned 18 I bought 85 Bitcoin @ around 235 each with a $20k student line of credit. Instead of going to college I used that money to buy Bitcoin and when i talked about it back then everyone said I was an idiot for doing it. But it worked out great because bitcoin was still a nascent technology at the time. Along with holding my initial position I doubled down many times and greatly grew my stack.

The problem with buying Bitcoin on credit these days is that the free market alone no longer really determines the price of btc and you are leaving yourself open to being wiped out by a financial entities manipulation. There are lots of government, corporate and central bank games being played with Bitcoin today. In the early bitcoin days things happened organically, it was simple supply and demand that caused the btc price to go up and down. There was also the fact it was a new technology and even if there wasn't demand for btc at some points back then you could still say you believe in the tech and if the tech was solid it would pay off down the line and bitcoin will go mainstream resulting in the btc price exploding.

Well that dream was realized and Bitcoin went mainstream. But the fact that bitcoin is mainstream now also means it has achieved deeper integration with financial institutions and the government. These entities are now manipulating the price of bitcoin like they did with traditional assets. Bitcoin can now have a manufactured downtrend in price caused by these financial institutions. Let's say you buy bitcoin on credit one day, you could be wiped out and lose everything not because of organic sell pressure but because of government/tradfi manipulation pushing the price down. This wasn't a problem back then but it is now. They have enough money to decide when btc pumps and when it dumps because they literally print fiat and unfortunately many in the space today only care about btc going up so they can dump it for fiat. This plays directly into the hands of the financial institutions and central banks. These are the entities that cause recessions, maybe they create another one once you buy on credit and you get wiped out that way. So these days it could be better to buy btc with your own money instead of on credit, so even if there is a downtrend you can still keep your btc and ride it to $1m per coin instead of having to sell it in a downtrend to pay off your credit resulting in you missing gains.

Also 10 years ago when Bitcoin was $200 each the marketcap was 3 billion, today the Bitcoin marketcap is 2.4 trillion. Almost 1000x bigger. Orders of magnitude of more money needs to be put into bitcoin today to move it the exact same percentage as back then. in 2015 if btc marketcap went up another 3 billion that would double the price. Today for the price to double another 2.4 Trillion needs to be added to the marketcap. Of course literally $2.4 T dollars don't need to be injected but you get what I'm saying, we're on a bigger scale now and it takes much more to move the price. We aren't seeing frequent 40% daily pumps and weekly 10x increase in price anymore for a reason.

For clarification I still think btc is going to $1m per bitcoin, so of course if you time your credit buys properly you'll come out ahead but do you really think you can time it? The risk of getting caught in a downturn is really big and that could wipe you out.

And sorry if this seemed like a doomer post, I don't want this to be taken as a bearish post because I'm still super bullish on Bitcoin and always have been. I just think the central banks are now greatly manipulating bitcoin and wiping people out so they can get even more of peoples bitcoin and control the supply as much as possible. This is all a big plan by them to manipulate Bitcoin like they do everything else, they don't want people owning btc they want it all for themselves. A lot of these ETFs, btc treasuries and other recent tradfi integrations of bitcoin will be used by the government to control the supply of Bitcoin.

And even though I say the risk of buying credit on bitcoin is huge today and I wouldn't recommend it some part of me still wants to beat this government and tradfi trash that is trying to corrupt Bitcoin lol. I think I can beat them at their own game so I still have some credit btc positions open. I'm happy I was able to use the tradfi system against them back then and use their credit to purchase real currency btc. That's really the moral in all this, going against fiat and doing your best to make Bitcoin prevail.",,True,,False
bitcoin,1oh87wx,He told me he has more Bitcoin than the government,Kazgarth_,2025-10-27T08:35:38,1088,0.97,82,https://i.redd.it/thsnrj83ylxf1.jpeg,https://reddit.com/r/Bitcoin/comments/1oh87wx/he_told_me_he_has_more_bitcoin_than_the_government/,,,False,,False
bitcoin,1o245wk,Oof,TheUnholyMoly,2025-10-09T13:08:17,1081,0.95,47,https://i.redd.it/hejq0h5eu2uf1.jpeg,https://reddit.com/r/Bitcoin/comments/1o245wk/oof/,,,False,,False
bitcoin,1nx94r3,Study ₿itcoin,Bubbly_Ice3836,2025-10-03T20:45:14,1072,0.95,73,https://i.redd.it/91ve9i8gaysf1.jpeg,https://reddit.com/r/Bitcoin/comments/1nx94r3/study_itcoin/,"The fiat ship is sinking faster and faster, but for ₿itcoiners, Uptober is looking real good.

2025 is the year ₿itcoin goes mainstream.

Let's get ready for the Final Repricing.",,False,,False
bitcoin,1o5x6i5,This is totally me,BTCgominingminer,2025-10-13T22:41:08,1049,0.99,39,https://i.redd.it/33ee3zf88yuf1.jpeg,https://reddit.com/r/Bitcoin/comments/1o5x6i5/this_is_totally_me/,,,False,,False
bitcoin,1nu1h8z,The road to becoming filthy rich is tough😅📈💪🚀,Same-Abroad-993,2025-09-30T03:30:41,1039,0.93,46,https://i.redd.it/gcm4j9x4r7sf1.jpeg,https://reddit.com/r/Bitcoin/comments/1nu1h8z/the_road_to_becoming_filthy_rich_is_tough/,,,False,,False
bitcoin,1o6i9mb,It is impossible to fake energy,Jeovanni98,2025-10-14T16:15:07,1011,0.91,28,https://i.redd.it/77rxnys3g3vf1.jpeg,https://reddit.com/r/Bitcoin/comments/1o6i9mb/it_is_impossible_to_fake_energy/,,,False,,False
bitcoin,1ogk7cd,Maximum respect for the guy who posted this image at 103,Kind_Cheetah_1289,2025-10-26T14:09:11,1015,0.94,86,https://i.redd.it/53iq1e9gggxf1.jpeg,https://reddit.com/r/Bitcoin/comments/1ogk7cd/maximum_respect_for_the_guy_who_posted_this_image/,"I don’t know who it was, but he has my utmost respect. I was panicking that day (this image had a huge impact on me), and now I’m laughing about it… Huge respect to the subreddit as well!",,False,,False
bitcoin,1nw88uo,Uptober 📈,American_Bitcoin_,2025-10-02T17:17:27,1006,0.97,60,https://i.redd.it/9z2k95vg4qsf1.jpeg,https://reddit.com/r/Bitcoin/comments/1nw88uo/uptober/,Two days into Uptober… how’re we feeling? New ATH soon?,,False,,False
bitcoin,1nx45jp,I love Uptober,relaiapp,2025-10-03T17:37:53,1003,0.98,30,https://i.redd.it/qqoovns0dxsf1.jpeg,https://reddit.com/r/Bitcoin/comments/1nx45jp/i_love_uptober/,,,False,,False
bitcoin,1nw560w,One of the key points!,seraf_01,2025-10-02T15:22:06,992,0.99,18,https://i.redd.it/knr6vzbvjpsf1.jpeg,https://reddit.com/r/Bitcoin/comments/1nw560w/one_of_the_key_points/,,,False,,False
bitcoin,1o6daf3,The crypto market explained,Nahfrg,2025-10-14T12:47:25,985,0.98,36,https://v.redd.it/tw3msl58f2vf1,https://reddit.com/r/Bitcoin/comments/1o6daf3/the_crypto_market_explained/,,,False,,False
bitcoin,1o97j29,Bottom signal,Redditistuncool,2025-10-17T18:25:41,978,0.94,227,https://i.redd.it/mkeuwdxaipvf1.png,https://reddit.com/r/Bitcoin/comments/1o97j29/bottom_signal/,,,False,,False
bitcoin,1oa7q5h,Bitcoin was $400,Kazgarth_,2025-10-18T22:19:23,956,0.98,30,https://i.redd.it/hxc4ru9nsxvf1.jpeg,https://reddit.com/r/Bitcoin/comments/1oa7q5h/bitcoin_was_400/,,,False,,False
bitcoin,1o0oxzi,Get in now.,InfinityLife,2025-10-07T20:39:56,938,0.98,58,https://v.redd.it/uronirqvsqtf1,https://reddit.com/r/Bitcoin/comments/1o0oxzi/get_in_now/,,,False,,False
bitcoin,1o4t05l,How does a $14k drop ruin some of  us?,GobiEats,2025-10-12T17:07:28,933,0.93,426,https://www.reddit.com/r/Bitcoin/comments/1o4t05l/how_does_a_14k_drop_ruin_some_of_us/,https://reddit.com/r/Bitcoin/comments/1o4t05l/how_does_a_14k_drop_ruin_some_of_us/,I don’t get it. How does a 11% drop bankrupt some BTC holders?  I keep hearing about people being ruined. Just hold your bag and wait for the bounce. ,,True,,False
bitcoin,1o2fxyl,Someone check up on him,Available_Reveal4066,2025-10-09T20:51:09,935,0.95,79,https://i.redd.it/70tzsgkx45uf1.png,https://reddit.com/r/Bitcoin/comments/1o2fxyl/someone_check_up_on_him/,,,False,,False
bitcoin,1nzozj0,UPtober not disappointing so far,djdimsim,2025-10-06T18:09:26,925,0.99,20,https://i.redd.it/f6nmrixdxitf1.jpeg,https://reddit.com/r/Bitcoin/comments/1nzozj0/uptober_not_disappointing_so_far/,,,False,,False
bitcoin,1ocfp7y,Looks like uptober is back on the menu boys,Mantis-Prawn,2025-10-21T16:16:11,915,0.93,79,https://i.redd.it/m16n9gmrehwf1.jpeg,https://reddit.com/r/Bitcoin/comments/1ocfp7y/looks_like_uptober_is_back_on_the_menu_boys/,,,False,,False
bitcoin,1ny6ozz,No words needed…,simulatedconscience,2025-10-04T22:53:50,913,0.97,52,https://i.redd.it/spgb25wa26tf1.jpeg,https://reddit.com/r/Bitcoin/comments/1ny6ozz/no_words_needed/,"Kids holding an inflated balloon and it will eventually go up no matter what unless the whole system pops…

Crazy 💯
We have entered into a new world I swear ong..",,False,,False
bitcoin,1och0k9,"Gold drops, BTC pumps. The rotation is happening.",alancarroII,2025-10-21T17:05:56,899,0.93,110,https://i.redd.it/t5asfzcqnhwf1.jpeg,https://reddit.com/r/Bitcoin/comments/1och0k9/gold_drops_btc_pumps_the_rotation_is_happening/,,,False,,False
bitcoin,1nyf3v1,Happy ATH everyone!,SubstanceSweaty8807,2025-10-05T05:47:29,879,0.98,28,https://i.redd.it/dlgj4k1348tf1.png,https://reddit.com/r/Bitcoin/comments/1nyf3v1/happy_ath_everyone/,,,False,,False
bitcoin,1o97gd2,Traders: BTC is dead again.,SetNo6506,2025-10-17T18:22:51,873,0.97,34,https://i.redd.it/pcqg1jwshpvf1.png,https://reddit.com/r/Bitcoin/comments/1o97gd2/traders_btc_is_dead_again/,,,False,,False
bitcoin,1nx7qjs,And so it begins again.,InfinityLife,2025-10-03T19:51:46,874,0.98,25,https://i.redd.it/f37d9dks0ysf1.png,https://reddit.com/r/Bitcoin/comments/1nx7qjs/and_so_it_begins_again/,,,False,,False
bitcoin,1o9avj0,Close friend with a PhD just sent me this... you're probably early,M3174W4Y,2025-10-17T20:33:31,874,0.9,133,https://i.redd.it/3m289jl35qvf1.jpeg,https://reddit.com/r/Bitcoin/comments/1o9avj0/close_friend_with_a_phd_just_sent_me_this_youre/,,,False,,False
bitcoin,1ohmd8c,Look what I found in my city,_Jokki,2025-10-27T19:28:24,861,0.97,9,https://i.redd.it/fnxvf5uk6pxf1.jpeg,https://reddit.com/r/Bitcoin/comments/1ohmd8c/look_what_i_found_in_my_city/,,,False,,False
bitcoin,1oinnyn,You’re going sane in an insane world,BTC_is_waterproof,2025-10-28T23:32:48,860,0.95,53,https://i.redd.it/6uqam1p4jxxf1.jpeg,https://reddit.com/r/Bitcoin/comments/1oinnyn/youre_going_sane_in_an_insane_world/,,,False,,False
bitcoin,1nyf9si,New all time high !!! 125k!!!,LorenzoMatterhorn69,2025-10-05T05:56:43,846,0.97,62,https://i.redd.it/ygyp5xzq58tf1.jpeg,https://reddit.com/r/Bitcoin/comments/1nyf9si/new_all_time_high_125k/,Literally just woke up to this!!! Lets fking goooooooooo !!!!!,,False,,False
bitcoin,1og4ew2,Bitcoin will be $1M in 2030,FarBad1864,2025-10-25T23:22:49,820,0.8,348,https://www.reddit.com/r/Bitcoin/comments/1og4ew2/bitcoin_will_be_1m_in_2030/,https://reddit.com/r/Bitcoin/comments/1og4ew2/bitcoin_will_be_1m_in_2030/,I wonder how much purchasing power $1M will have in 2030 tho. ,,True,,False
bitcoin,1obvfgx,"Don't trust, verify",unthocks,2025-10-20T23:09:33,812,0.96,57,https://i.redd.it/ahx7qgpobcwf1.jpeg,https://reddit.com/r/Bitcoin/comments/1obvfgx/dont_trust_verify/,,,False,,False
bitcoin,1oajos6,They told me to diversify. I Listened!,Kazgarth_,2025-10-19T08:41:42,813,0.97,28,https://i.redd.it/fxwigbwxv0wf1.jpeg,https://reddit.com/r/Bitcoin/comments/1oajos6/they_told_me_to_diversify_i_listened/,,,False,,False
bitcoin,1o3d5p9,HODL,Accomplished-Ad-4896,2025-10-10T22:11:08,807,0.98,49,https://i.redd.it/wgt9m153ocuf1.jpeg,https://reddit.com/r/Bitcoin/comments/1o3d5p9/hodl/,hodl,,False,,False
bitcoin,1of2mg6,Most of my friends be like 😂🤦,Ayymansaeedh,2025-10-24T17:38:28,804,0.98,16,https://i.redd.it/uynucbo983xf1.jpeg,https://reddit.com/r/Bitcoin/comments/1of2mg6/most_of_my_friends_be_like/,,,False,,False
bitcoin,1o29702,Which one of you is this,alancarroII,2025-10-09T16:35:52,803,0.96,183,https://i.redd.it/o078aqgfv3uf1.jpeg,https://reddit.com/r/Bitcoin/comments/1o29702/which_one_of_you_is_this/,,,False,,False
bitcoin,1oejl8l,First transaction in 14.3 years,LavishlyRitzyy,2025-10-24T01:18:35,801,0.98,133,https://i.redd.it/l045ojvbdywf1.png,https://reddit.com/r/Bitcoin/comments/1oejl8l/first_transaction_in_143_years/,"Was worth just $67,000 in 2011",,False,,False
bitcoin,1o0aupi,Just bought my first 150 euros in bitcoin,Dmc_ryan_,2025-10-07T11:19:50,787,0.93,150,https://i.redd.it/qeczdxc71otf1.png,https://reddit.com/r/Bitcoin/comments/1o0aupi/just_bought_my_first_150_euros_in_bitcoin/,please turn green,,False,,False
bitcoin,1nyy43j,"If it makes you feel better, you officially own more Bitcoin than Germany (50K BTC gone)",Kazgarth_,2025-10-05T20:49:09,788,0.94,116,https://i.redd.it/gl2up8mfkctf1.jpeg,https://reddit.com/r/Bitcoin/comments/1nyy43j/if_it_makes_you_feel_better_you_officially_own/,,,False,,False
bitcoin,1nztdak,"""Bitcoin will never reach $20 again""",DankSavant,2025-10-06T20:51:54,781,0.96,84,https://i.redd.it/ttkhz1ddqjtf1.png,https://reddit.com/r/Bitcoin/comments/1nztdak/bitcoin_will_never_reach_20_again/,🫠,,False,,False
bitcoin,1oe66j1,They got him again! Another $100 million liquidation for James Wynn.,Obvireal,2025-10-23T16:22:58,769,0.89,169,https://i.redd.it/2stdmwyvpvwf1.jpeg,https://reddit.com/r/Bitcoin/comments/1oe66j1/they_got_him_again_another_100_million/,,,False,,False
bitcoin,1nyk8vl,$2.5k off ATH,djdimsim,2025-10-05T11:00:55,767,0.96,28,https://i.redd.it/8xhu5kt0o9tf1.png,https://reddit.com/r/Bitcoin/comments/1nyk8vl/25k_off_ath/,,,False,,False
bitcoin,1nyhbxr,HAPPY ATH (long term hodler edition),InfinityLife,2025-10-05T07:57:55,771,0.99,18,https://i.redd.it/rwydatj9r8tf1.png,https://reddit.com/r/Bitcoin/comments/1nyhbxr/happy_ath_long_term_hodler_edition/,,,False,,False
bitcoin,1o2e64z,Not f*cking selling,InfinityLife,2025-10-09T19:42:44,769,0.92,173,https://v.redd.it/lpwp2cxos4uf1,https://reddit.com/r/Bitcoin/comments/1o2e64z/not_fcking_selling/,,,False,,False
bitcoin,1odjp21,Fear & Greed Index at Extreme Fear,Bubbly_Ice3836,2025-10-22T21:33:24,741,0.98,47,https://i.redd.it/k5xjep1d4qwf1.jpeg,https://reddit.com/r/Bitcoin/comments/1odjp21/fear_greed_index_at_extreme_fear/,"That's how we know The Real Uptober is coming.

Source: https://www.bitcoinmagazinepro.com/charts/bitcoin-fear-and-greed-index/",,False,,False
bitcoin,1o1795c,Crypto Millionaires +,redditingname,2025-10-08T11:57:22,731,0.98,69,https://i.redd.it/me65c8ttcvtf1.jpeg,https://reddit.com/r/Bitcoin/comments/1o1795c/crypto_millionaires/,This was on CNBC this morning and this post is meant for motivation more than anything. The vast majority of people achieving these levels of wealth in bitcoin HODL’d through a lot of tough markets and crazy news cycles. Cheers!,,False,,False
bitcoin,1nub1mn,"Chinese woman convicted after 'world's biggest' bitcoin seizure (61,000 BTC)",opiikex,2025-09-30T12:50:40,723,0.96,126,https://www.bbc.com/news/articles/cy0415kk3rzo,https://reddit.com/r/Bitcoin/comments/1nub1mn/chinese_woman_convicted_after_worlds_biggest/,,,False,,False
bitcoin,1o9nmnx,"Yes. Don't work, just have capital, buy Bitcoin and make memes.",unthocks,2025-10-18T06:36:05,725,0.98,31,https://i.redd.it/93h3wram4tvf1.jpeg,https://reddit.com/r/Bitcoin/comments/1o9nmnx/yes_dont_work_just_have_capital_buy_bitcoin_and/,,,False,,False
bitcoin,1o4evt5,Brace Yerself Soldier 🫡,unthocks,2025-10-12T04:34:11,719,0.77,173,https://i.redd.it/vlf7udiepluf1.jpeg,https://reddit.com/r/Bitcoin/comments/1o4evt5/brace_yerself_soldier/,"Buy the dip, sell your balls if needed to, buy it. What's the point of your balls if you don't put it in a good use 😌",,False,,False
bitcoin,1ofhw2x,I found a block as a solo miner from home.,EightofSpace,2025-10-25T04:55:54,721,0.97,145,https://www.reddit.com/gallery/1ofhw2x,https://reddit.com/r/Bitcoin/comments/1ofhw2x/i_found_a_block_as_a_solo_miner_from_home/,"I am so excited and happy, i had to tell someone, everyone. We all know those lucky miners were hitting blocks, a rarity compared to to commercial miners. I came in to a little money and bought some lucky miners. 6 nerdqaxe++ and a avalon q. I knew i would hit a block in my lifetime, i just want 1.

Well i fing did it. Its been only 1 months and a half and i did the impossible. I am beyond psyched.
It was $347,564.  Tax will eat 158k leaving me with 200k.  I can pay off my damn house and be free.

I was getting 6G difficulty and i recently got a 212G. I was expecting a 1T at some point but gawd damn i found. 2.08P difficulty valid block. Dont bother dming me as i will just delete it all. I also already “sync” and “validated” my wallet ok.",,False,,False
bitcoin,1o84hk7,"Not your wife, not your keys.",Kazgarth_,2025-10-16T13:13:10,715,0.9,67,https://i.redd.it/2yecbrlmtgvf1.jpeg,https://reddit.com/r/Bitcoin/comments/1o84hk7/not_your_wife_not_your_keys/,,,False,,False
bitcoin,1ocdlkf,14 years ago,rtmxavi,2025-10-21T14:53:55,709,0.98,68,https://v.redd.it/zlc3sk450hwf1,https://reddit.com/r/Bitcoin/comments/1ocdlkf/14_years_ago/,,,False,,False
bitcoin,1odp2gj,Buy the dip while it lasts,unthocks,2025-10-23T01:20:39,710,0.93,44,https://i.redd.it/ma1w1ofw8rwf1.jpeg,https://reddit.com/r/Bitcoin/comments/1odp2gj/buy_the_dip_while_it_lasts/,,,False,,False
