subreddit,post_id,title,author,created_utc,score,upvote_ratio,num_comments,url,permalink,selftext,link_flair_text,is_self,distinguished,stickied
ethereum,1ohuftl,Holešky testnet is deprecated and has stopped finalizing,abcoathup,2025-10-28T00:44:53,20,0.86,6,https://light-holesky.beaconcha.in/,https://reddit.com/r/ethereum/comments/1ohuftl/holešky_testnet_is_deprecated_and_has_stopped/,,,False,,False
ethereum,1ocjtu2,DIDs are a Dead End,oed_,2025-10-21T18:51:44,19,0.88,4,https://jthor.eth.link/blog/2025/10/21/did-dead-end/,https://reddit.com/r/ethereum/comments/1ocjtu2/dids_are_a_dead_end/,"Sharing my perspective on W3C's DID standard, from my few years working with it, while trying to stay true to decentralized ideals.",,False,,False
ethereum,1o7kehq,Fusaka Update - Information for Blob users | Ethereum Foundation Blog,abcoathup,2025-10-15T20:18:53,18,0.95,0,https://blog.ethereum.org/2025/10/15/fusaka-blob-update,https://reddit.com/r/ethereum/comments/1o7kehq/fusaka_update_information_for_blob_users_ethereum/,,Technology,False,,False
ethereum,1o2nlcg,"All Core Devs - Execution (ACDE) #222: 
🦓 Fusaka upgrade: ✅ Holešky testnet BPO1 ✅ Sepolia testnet shadow fork
🌠 Glamsterdam upgrade: 🔲 EIP7928 Block-level Access Lists (BALs): 🔜 devnet-0, 🧪 80% of tests passing; 🗳️ Proposed non-headliner EIPs: presentations",abcoathup,2025-10-10T02:17:50,17,0.87,0,https://ethereum-magicians.org/t/all-core-devs-execution-acde-222-october-9-2025/25624/2,https://reddit.com/r/ethereum/comments/1o2nlcg/all_core_devs_execution_acde_222_fusaka_upgrade/,,Protocol call,False,,False
ethereum,1nwn5p3,"All Core Devs - Consensus (ACDC) #166: 🦓 Fusaka upgrade (~December): ✅ Holešky testnet upgraded, ✅ devnet-3 non-finality testing; 💫 Glamsterdam upgrade (2026): ePBS & trustless payments - split discussion; Proposed EIPs need a champion; ⭐️H-star upgrade: name needed",abcoathup,2025-10-03T03:20:46,17,0.9,0,https://ethereum-magicians.org/t/all-core-devs-consensus-acdc-166-october-2-2025/25573/2,https://reddit.com/r/ethereum/comments/1nwn5p3/all_core_devs_consensus_acdc_166_fusaka_upgrade/,,Protocol call,False,,False
ethereum,1o7qhd2,Buying ETH with 401k brokerage account,Defiant-Charge-5317,2025-10-16T00:19:26,15,0.73,38,https://www.reddit.com/r/ethereum/comments/1o7qhd2/buying_eth_with_401k_brokerage_account/,https://reddit.com/r/ethereum/comments/1o7qhd2/buying_eth_with_401k_brokerage_account/,"Hi all, 
I’m planning to put all my 401k money into an ethereum ETF. I’ve seen a bunch of ETFs managed by blackrock, fidelity & grayscale. Can you please help me pick the best eth ETF that tracks ETH to buy? 
Thanks. ",,True,,False
ethereum,1od6wyy,Switzerland's First Blockchain-Integrated Bank Implements ERC-2535 Diamonds,mudgen,2025-10-22T13:29:47,14,1.0,0,https://i.redd.it/fg3j8zxapnwf1.png,https://reddit.com/r/ethereum/comments/1od6wyy/switzerlands_first_blockchainintegrated_bank/,"Stobox recently launched a regulated security token offering (STO) for Monerys AG — and it’s powered by the **EIP-2535 Diamond Standard**.

According to their announcement, the Stobox 4 tokenization platform’s **STV3 Protocol Architecture** is built on Diamonds, giving it modular and upgradeable smart contracts. This allows the security token’s logic (compliance rules, jurisdictional requirements, governance modules, etc.) to evolve without redeploying the token contract.

Why this matters:

* **Regulatory flexibility** – facets can be upgraded to meet changing legal requirements.
* **Stability** – the token address stays the same, aiding audits and investor trust.
* **Reusability** – the platform can support multiple offerings using shared contract modules.

This is one of the first public examples of **Diamonds used in a regulated STO**, showcasing how EIP-2535 can support real-world asset tokenization and long-term contract maintenance.

Full article: [https://blog.stobox.io/monerys-ag-launches-first-security-token-offering-on-stobox-4/](https://blog.stobox.io/monerys-ag-launches-first-security-token-offering-on-stobox-4/)",,False,,False
ethereum,1o93cjh,Etherhiding - when hackers turn blockchain to host decentralized malware,Fast-Reality8021,2025-10-17T15:48:42,15,0.86,3,https://arstechnica.com/security/2025/10/hackers-bullet-proof-hosts-deliver-malware-from-blockchains/,https://reddit.com/r/ethereum/comments/1o93cjh/etherhiding_when_hackers_turn_blockchain_to_host/,"On the surface this sounds bad because Ether is known for its stability, which also means these malware hosts are hard to take down.

What's your thoughts? Is this something that can be patched out? ",,False,,False
ethereum,1o8nto9,"All Core Devs - Consensus (ACDC) #167 

🦓 Fusaka upgrade: 📅 mainnet proposed for Dec 3 (not set yet); ✅ audit contest;✅ Holešky testnet BPO2 (14/21 blobs); ✅ Sepolia testnet (L2s surprised by blob to cell proofs change); 📅 Hoodi testnet Oct 28

💫 Glamsterdam upgrade: ePBS with trustless payments",abcoathup,2025-10-17T02:07:23,14,0.89,0,https://ethereum-magicians.org/t/all-core-devs-consensus-acdc-167-october-16-2025/25679/2,https://reddit.com/r/ethereum/comments/1o8nto9/all_core_devs_consensus_acdc_167_fusaka_upgrade/,,Protocol call,False,,False
ethereum,1ohlggc,"Analysis: On-chain metrics (TX count, Gas, L2s) are trending up. Is this just a bounce, or a return of real network activity?",Delicious-Algae7241,2025-10-27T18:55:17,12,0.88,3,https://www.reddit.com/r/ethereum/comments/1ohlggc/analysis_onchain_metrics_tx_count_gas_l2s_are/,https://reddit.com/r/ethereum/comments/1ohlggc/analysis_onchain_metrics_tx_count_gas_l2s_are/,"Noticed something interesting today while looking at ETH charts (see image).
Instead of focusing on the price itself, I looked at the on-chain side:
​Transaction count and gas usage are both trending higher again.
​Layer-2 networks seem to be heating up (especially Arbitrum & Base).
​Staking deposits also ticked up over the past few days.
​To me, this looks like more than just a “speculative bounce.”
It feels like the network itself is waking up again.
​I’m curious — for those who’ve been here since 2021, does this pattern feel similar to the early stages of previous cycles?
Would love to hear your thoughts on what metrics you watch when ETH gains momentum.",,True,,False
ethereum,1odcg29,"Building a privacy-friendly subscription system for Web3 users (no KYC, no emails) — looking for alternatives to Stripe",sabz7,2025-10-22T17:05:44,11,0.93,4,https://www.reddit.com/r/ethereum/comments/1odcg29/building_a_privacyfriendly_subscription_system/,https://reddit.com/r/ethereum/comments/1odcg29/building_a_privacyfriendly_subscription_system/,"Hey all,

I’m working on a Web3 tool that uses a **tiered subscription model** (monthly access, different feature sets per tier). The catch:

* Our audience are **privacy-first Web3 users**, so we **don’t want to collect emails** or any personal info.
* We also **can’t really use Stripe**, since that involves traditional KYC and fiat rails.
* Each user might **connect multiple wallets** under the same subscription tier.

I’m trying to figure out the cleanest way to implement this kind of setup.

Some early thoughts:

* Using **smart contracts** for subscription tiers (maybe via ERC-721 or ERC-1155 “membership NFTs”).
* Payment in **stablecoins** (USDC, DAI, etc.) or native gas tokens (ETH, MATIC, etc.).
* Maybe integrate something like **Superfluid** for streaming payments, or **Unlock Protocol** for token-gated access.
* Managing multiple wallets per user without a centralized identity layer is tricky — possibly link wallets via signed messages or ENS text records?

Has anyone tackled a **non-custodial, privacy-respecting subscription** model before?  
What tools or protocols would you recommend as “Web3-native Stripe alternatives”?

Would love to hear how others are approaching subscription logic, recurring payments, and wallet linking in decentralized contexts.",,True,,False
ethereum,1o29l1j,"Ethereum Builder Survey for L2s, AVSs, Oracles, DePIN and other protocol / networks",aItalianStallion,2025-10-09T16:50:40,13,0.93,0,https://www.reddit.com/r/ethereum/comments/1o29l1j/ethereum_builder_survey_for_l2s_avss_oracles/,https://reddit.com/r/ethereum/comments/1o29l1j/ethereum_builder_survey_for_l2s_avss_oracles/,"Hey r/Ethereum fam!

Obol is the leading Ethereum staking technology company, with over $3.2B in stake secured by Obol Distributed Validators and rapidly growing - supported by top angels like Sreeram Kannan, Anthony Sassano, David Hoffman, Dankrad Feist, and backed by Pantera, Archetype, Maelstrom, and more.

While we lead in Ethereum staking, our mission extends far beyond.

We’re now exploring how a new technology we are building can support L2s, AVSs, oracles, DePIN networks, and any protocol / network projects that requires a decentralized operator set.

If you're building in one of those categories, we’d love your quick input on a confidential 2-minute-survey.

[https://docs.google.com/forms/d/e/1FAIpQLSdw\_Co5MFtHHU03I2q82hjJHLh7JJsoavexuz9FbJzP0mOHdg/viewform?usp=header](https://docs.google.com/forms/d/e/1FAIpQLSdw_Co5MFtHHU03I2q82hjJHLh7JJsoavexuz9FbJzP0mOHdg/viewform?usp=header)",,True,,False
ethereum,1o18le3,"StrikeX, in Collaboration with CMC Markets and CapX, Completes First Tokenised Share Issue, Setting…",Ste19921992,2025-10-08T13:06:14,12,0.93,3,https://blog.strikex.com/strikex-in-collaboration-with-cmc-markets-and-capx-completes-first-tokenised-share-issue-setting-e1e5f1fecc51,https://reddit.com/r/ethereum/comments/1o18le3/strikex_in_collaboration_with_cmc_markets_and/,,,False,,False
ethereum,1nw61x7,"AMA w David Phelps (cofounder, JokeRace, the platform to vote and earn in contests)",divine_economy,2025-10-02T15:56:15,12,0.83,11,https://www.reddit.com/r/ethereum/comments/1nw61x7/ama_w_david_phelps_cofounder_jokerace_the/,https://reddit.com/r/ethereum/comments/1nw61x7/ama_w_david_phelps_cofounder_jokerace_the/,"Hi everyone!

I'm David, cofounder of [JokeRace](http://jokerace.io).

JokeRace is a platform for anyone to earn by voting with conviction on their tastes, preferences, and beliefs. Creators can launch campaigns for anything, including demo days, community awards, polls, group decisions, design contests, and even reality TV shows. 

Players can buy votes on entries: their funds go into a rewards pool, and voters on winning entries earn a proportionate share of the rewards. In the first two months after launching price curves—which give higher ROI to early conviction voters—JokeRace has generated over $1,500,000 for voters.

I also post a bunch about crypto on [Twitter](https://x.com/divine_economy) (as I keep calling it) and [Substack](https://davidphelps.substack.com/).

AMA about anything you like: prediction markets vs conviction markets, why the attention economy runs on feuds, why good marketing should be free, or what it's like to build an app in crypto or generally (this is my third company!) 

Excited to be here. ",,True,,False
ethereum,1ocjo6i,The Road to Core Solidity,ligi,2025-10-21T18:46:01,12,0.87,0,https://www.soliditylang.org/blog/2025/10/21/the-road-to-core-solidity/,https://reddit.com/r/ethereum/comments/1ocjo6i/the_road_to_core_solidity/,,,False,,False
ethereum,1nzl8ve,"Ethereum self-custodial Web wallet (not an extension, a full Web app). Are we alone or are there others?",CoinWalletLLC,2025-10-06T15:53:00,10,0.86,20,https://www.reddit.com/r/ethereum/comments/1nzl8ve/ethereum_selfcustodial_web_wallet_not_an/,https://reddit.com/r/ethereum/comments/1nzl8ve/ethereum_selfcustodial_web_wallet_not_an/,"Hey everyone! We're a self-custodial, open-source wallet [https://coin.space/](https://coin.space/)

We support all platforms (mobile, Windows, Linux, macOS, and even Tor), but it all began with a simple web app back in 2015.

Are there any **other wallets** out there like us? **Self-custodial** and a proper **web** application?

Please don’t scare users with phrases like ""the web is unsafe, etc"" - it’s just 1 of the 12 ways to access a wallet.

https://preview.redd.it/63thyhqw8itf1.png?width=1018&format=png&auto=webp&s=1c272a6ec094afa40b878a4ee2ae6064a47b6d7f

",,True,,False
ethereum,1oeycw5,The FED held a crypto conference- i made a video explaining what this means,sshinski,2025-10-24T14:53:22,10,0.78,8,https://www.reddit.com/r/ethereum/comments/1oeycw5/the_fed_held_a_crypto_conference_i_made_a_video/,https://reddit.com/r/ethereum/comments/1oeycw5/the_fed_held_a_crypto_conference_i_made_a_video/,"I made a video to explain why this is so meaningful to the crypto/blockchain/stablecoin community's and what this could mean in terms of a regulatory pathway.

https://youtu.be/024pRy4d8F8?si=YikKUkBh2n2h4TgI

Leave me a comment and let me know what you think ",,True,,False
ethereum,1oemcxn,Highlights from the All Core Developers Execution (ACDE) Call #223,Y_K_C_,2025-10-24T03:36:23,9,0.92,0,https://etherworld.co/2025/10/23/highlights-from-the-all-core-developers-execution-acde-call-223/,https://reddit.com/r/ethereum/comments/1oemcxn/highlights_from_the_all_core_developers_execution/,,,False,,False
ethereum,1oc7krz,Permanent Shielded Voting is Coming to Snapshot,Smokyish,2025-10-21T09:38:40,10,0.92,0,https://blog.shutter.network/permanent-shielded-voting-is-coming-to-snapshot/,https://reddit.com/r/ethereum/comments/1oc7krz/permanent_shielded_voting_is_coming_to_snapshot/,,,False,,False
ethereum,1o2nlmv,New ERC Proposal for Diamond Storage,mudgen,2025-10-10T02:18:13,10,0.86,0,https://ethereum-magicians.org/t/erc-tba-diamond-storage/25718,https://reddit.com/r/ethereum/comments/1o2nlmv/new_erc_proposal_for_diamond_storage/,,,False,,False
ethereum,1nx3jhg,Tokenized stocks and self custody,Robru3142,2025-10-03T17:15:34,11,1.0,8,https://www.reddit.com/r/ethereum/comments/1nx3jhg/tokenized_stocks_and_self_custody/,https://reddit.com/r/ethereum/comments/1nx3jhg/tokenized_stocks_and_self_custody/,"If a stock is tokenized on ethereum, what role does DTC have? If the token is sold to another EOA, does the DTC get notification of a change of ownership of the stock?",,True,,False
ethereum,1oiim1f,We just open-sourced an LLM to help write secure & OpenZeppelin-compliant Solidity code,SolidityScan,2025-10-28T20:17:23,9,1.0,2,https://www.reddit.com/r/ethereum/comments/1oiim1f/we_just_opensourced_an_llm_to_help_write_secure/,https://reddit.com/r/ethereum/comments/1oiim1f/we_just_opensourced_an_llm_to_help_write_secure/,"Hey folks, our team at CredShields just released an open-source LLM Solidity-CodeGen-v0.1 designed to help developers write cleaner, more secure, and OpenZeppelin-compliant smart contracts.The model can assist with:Generating boilerplate code that follows secure patternsIdentifying risky constructs earlySuggesting safer Solidity syntax and structure",,True,,False
ethereum,1ohule7,GG24 (Gitcoin Grants 24): Developer Tooling & Infrastructure round ends October 29,abcoathup,2025-10-28T00:51:33,9,1.0,1,https://giveth.io/qf/gg24dti,https://reddit.com/r/ethereum/comments/1ohule7/gg24_gitcoin_grants_24_developer_tooling/,,Technology,False,,False
ethereum,1ofakpj,Austin Griffith - Ethereum Foundation - Doots Podcast,jtnichol,2025-10-24T22:53:43,9,0.8,2,https://youtu.be/E_h4Yc2MdR8?si=j78CMoi7q27-XHwo,https://reddit.com/r/ethereum/comments/1ofakpj/austin_griffith_ethereum_foundation_doots_podcast/,,,False,,False
ethereum,1oet1ba,Quick 90-second recap of the All Core Devs Execution (ACDE) #223 call,Y_K_C_,2025-10-24T10:19:59,10,1.0,0,https://youtu.be/ndjbY1lByO8?si=Vz47F9MUVz-fS91C,https://reddit.com/r/ethereum/comments/1oet1ba/quick_90second_recap_of_the_all_core_devs/,,,False,,False
ethereum,1odopoe,Suggestions for Best Way to Stake w/ a Hard Wallet?,Immediate_Dentist_80,2025-10-23T01:04:01,9,1.0,11,https://www.reddit.com/r/ethereum/comments/1odopoe/suggestions_for_best_way_to_stake_w_a_hard_wallet/,https://reddit.com/r/ethereum/comments/1odopoe/suggestions_for_best_way_to_stake_w_a_hard_wallet/,"Hi all,

I want to stake ETH from a hard wallet, similar to how I stake Solana from my Tangem wallet. 

Do you have any wallet suggestions or ways to do this? I’m trying to avoid Coinbase due to crazy staking fees. 

I am still a little new to cryptos and I appreciate any learning I get from this post. Thanks!",,True,,False
ethereum,1ocfok4,Question on how Bhutan national ID on Ethereum works,johanngr,2025-10-21T16:15:31,9,1.0,8,https://www.reddit.com/r/ethereum/comments/1ocfok4/question_on_how_bhutan_national_id_on_ethereum/,https://reddit.com/r/ethereum/comments/1ocfok4/question_on_how_bhutan_national_id_on_ethereum/,"When the user signs something with their national ID, does the party they verify against receive the full ID signed by the government (such that it can be leaked), and does these credentials (that conform to ""W3C standard"" right) include a ""decentralized identifier"", and on Ethereum there is a lookup table somewhere with Bhutan ""decentralized identifiers"" to public keys, such that the party being verified against can verify that the person was the owner of the credentials?

In other words, can the credentials trivially be leaked, as there is no ""trapdoor"" or such (as this requires the government key being the one that authenticates, and if user authenticates that part has to be sacrificed but the benefit is the government is no longer notified each time ID is used)?

**Edit:** According to Claude AI it seems BBS+ is what solves this problem, and lets the signed credentials still be proven only relative the party verified against, such that they cannot leak the credentials. **Edit:** It now seems the Bhutan ID does not have that property, and that it would require ""designated verifier signatures"". Anyone who is an expert on how Bhutan national ID works or the standard it is based on (W3C?) feel free to explain.

**Update:** It seems the Bhutan national ID is not private as proofs can be leaked (and in cybersecurity they should be considered public, anything that can leak will leak). Whereas designated verified signatures, an older and probably simpler system, seems to provide true privacy. I assumed ""state of the art"" national ID on Ethereum would do so, but seems it does not. I am *not an expert* on these things, and I am trying to understand best I can as I am interested in seeing advances in digital ID.

Steinfeld, R., Bull, L., Wang, H., Pieprzyk, J. (2003). Universal Designated-Verifier Signatures. In: Laih, CS. (eds) Advances in Cryptology - ASIACRYPT 2003. ASIACRYPT 2003. Lecture Notes in Computer Science, vol 2894. Springer, Berlin, Heidelberg. [https://doi.org/10.1007/978-3-540-40061-5\_33](https://doi.org/10.1007/978-3-540-40061-5_33)",,True,,False
ethereum,1oblr6x,EIP-8042 Diamond Storage is now a published ERC draft,mudgen,2025-10-20T16:30:27,8,0.84,0,https://eips.ethereum.org/EIPS/eip-8042,https://reddit.com/r/ethereum/comments/1oblr6x/eip8042_diamond_storage_is_now_a_published_erc/,,,False,,False
ethereum,1o7mnc7,Ethereum’s biggest strength might also be what keeps it messy,National-Poet-9165,2025-10-15T21:44:26,9,0.67,7,https://www.reddit.com/r/ethereum/comments/1o7mnc7/ethereums_biggest_strength_might_also_be_what/,https://reddit.com/r/ethereum/comments/1o7mnc7/ethereums_biggest_strength_might_also_be_what/,"Every upgrade, every new scaling solution, gives Ethereum more capabilities but it also adds complexity.  
It’s impressive, but sometimes it feels like a pile of experiments stacked on top of each other, held together by coordination and a bit of luck. That’s not a dig it’s just the reality of improving a network that’s live and constantly running. Bitcoin went for simplicity; Ethereum went for flexibility.",,True,,False
ethereum,1o6jfck,New smart contract library in the works. Focuses on onchain composability.,mudgen,2025-10-14T16:57:53,9,0.85,1,https://x.com/mudgen/status/1978126238855160254,https://reddit.com/r/ethereum/comments/1o6jfck/new_smart_contract_library_in_the_works_focuses/,,,False,,False
ethereum,1o6i51m,I’m making a game on an EVM,Mizzymax,2025-10-14T16:10:17,9,0.84,3,https://www.reddit.com/r/ethereum/comments/1o6i51m/im_making_a_game_on_an_evm/,https://reddit.com/r/ethereum/comments/1o6i51m/im_making_a_game_on_an_evm/,Looking to see if there was anyone wanting to expand/partner since porting over to EVM is simple. Building out a zombie game with a zombie memecoin airdrop. You can view our socials at @zOMbiesOfMantra on X,,True,,False
ethereum,1o3pkrz,Exodus Swap Stuck,SufficientSector28,2025-10-11T08:42:21,9,0.85,12,https://www.reddit.com/r/ethereum/comments/1o3pkrz/exodus_swap_stuck/,https://reddit.com/r/ethereum/comments/1o3pkrz/exodus_swap_stuck/,"Since Exodus won't let me post there, I'm here to ask you guys. The 2 outgoing pending transactions are sent automatically from exodus for Eth to USDT swap and are now stuck for over 12 hours. Will they eventually go through? Exodus team has told me the swap will only happen after they are no longer pending. Help.

https://etherscan.io/address/0x7b1032bfEd53FEA8F842cbd31968DA1bCe2F7a42",,True,,False
ethereum,1nxv7br,3-phase commit for true Raiden network,johanngr,2025-10-04T15:18:17,9,0.8,1,https://www.reddit.com/r/ethereum/comments/1nxv7br/3phase_commit_for_true_raiden_network/,https://reddit.com/r/ethereum/comments/1nxv7br/3phase_commit_for_true_raiden_network/,"All decentralized multihop payments like Raiden/Lightning (and also Ryan Fugger's base layer) have historically used a 2-phase commit that defaults to cancel the payment to manage the attack vector of money reserved for payment being stuck for all eternity. This solution brings with it the risk of a penalty (note, only on *one* of the phases) that may end up imposed on an innocent intermediary. The original solution to this in 2006 was to make the penalty gradual, a microscopic amount per second, but the problem is that the cumulative time until the payment times out then tends to get so long that the timeout itself no longer serves to solve the ""reserve payment attack"", and while the penalty could be a sufficient solution *there was only a penalty on one of the phases*. So, people settled for ""staggered timeouts"" as a work around, but this does not fix the problem, network failures or denial of service attacks can still cause an innocent intermediary to end up paying for the full payment.

The solution is to add the penalty on both phases. This is easily done once you realize that the *other* 2-phase commit, that finishes on timeout, also only has a penalty on one of the phases but it has it on the *opposite* phase. Thus, you can simply **combine** them and add a phase in between that shifts the action of the timeout, thus you get a 3-phase commit.

https://preview.redd.it/acpqejl9r3tf1.png?width=1008&format=png&auto=webp&s=b4714eaa27a4ad245d2ab352a11b3bc69fa9b339

I built Ryan Fugger's base layer already (just 2500 lines of code with zero dependencies) and adding ""collateral"" (""state proof"" on top of the ""base payment channel"") is very easy. Raiden could be built and finished with minimal work. If anyone is interested. My goal is already achieved with the base layer (as my vision only required it to exits) but I could help out with pointers if anyone wants to get a real Raiden created.

I have more material, video presentation, complete implementation, etc, if anyone is interested. And I can walk anyone through it as well in chat for example here in discussion thread, the 3-phase commit is **very simple** it was just a bit hard to discover as people tend to follow the path already made by others (the cancel-on-timeout 2-phase commit, whereas I approached the other one and naturally noticed both together would *transcend* the limitations of either).

Hakuna matata,  
Johan",,True,,False
ethereum,1nuq148,Dev Tools Guild September update | Dev Tools Guild: 🦓 Fusaka upgrade on testnets in October. 📛 ENS DAO $75k grant to Argot. ✈️ Aerodrome $450k donation. 🔴 Optimism Retro Funding supports members.,abcoathup,2025-09-30T22:36:33,9,0.85,1,https://devtoolsguild.xyz/blog/devtoolsguild-september-update,https://reddit.com/r/ethereum/comments/1nuq148/dev_tools_guild_september_update_dev_tools_guild/,,Technology,False,,False
ethereum,1ohg9gc,Can't complete Farcaster registration,Industrialman96,2025-10-27T15:42:59,9,0.91,1,https://www.reddit.com/r/ethereum/comments/1ohg9gc/cant_complete_farcaster_registration/,https://reddit.com/r/ethereum/comments/1ohg9gc/cant_complete_farcaster_registration/,"I tried to register before when payment was forced, but did not paid, then i recently saw that it allows to complete registration without payment

Logged in, it forces to complete the payment, even by using referal link it doesnt allow to complete

Tried to completely uninstall the app, using different email - it shows the same Create your account onchain with forced payment

How to create completely new account without paying?",,True,,False
