subreddit,post_id,title,author,created_utc,score,upvote_ratio,num_comments,url,permalink,selftext,link_flair_text,is_self,distinguished,stickied
cryptocurrency,1o3u526,Crime season,002_timmy,2025-10-11T13:16:58,54867,0.97,1179,https://i.redd.it/nqm2e6mr5huf1.jpeg,https://reddit.com/r/CryptoCurrency/comments/1o3u526/crime_season/,,GENERAL-NEWS,False,,False
cryptocurrency,1o6p76d,I think my parents are still mad about buying BTC at 127K,Odd-Radio-8500,2025-10-14T20:29:50,12490,0.91,316,https://i.redd.it/1lmduyppp4vf1.jpeg,https://reddit.com/r/CryptoCurrency/comments/1o6p76d/i_think_my_parents_are_still_mad_about_buying_btc/,,MEME,False,,False
cryptocurrency,1oap0wg,Just keep going to the right,CragBawz,2025-10-19T13:59:18,7462,0.97,243,https://i.redd.it/tt4aevxlg2wf1.jpeg,https://reddit.com/r/CryptoCurrency/comments/1oap0wg/just_keep_going_to_the_right/,,MEME,False,,False
cryptocurrency,1nzyh5p,Which one is it?,OfficialBONKfun,2025-10-07T00:08:13,6653,0.94,232,https://i.redd.it/54a5za3dpktf1.png,https://reddit.com/r/CryptoCurrency/comments/1nzyh5p/which_one_is_it/,,DEBATE,False,,False
cryptocurrency,1o3dtr6,"Over $3,000,000,000 liquidated from the crypto market in the past 60 minutes.",kirtash93,2025-10-10T22:37:20,5513,0.97,783,https://i.redd.it/rz1r9ywtscuf1.jpeg,https://reddit.com/r/CryptoCurrency/comments/1o3dtr6/over_3000000000_liquidated_from_the_crypto_market/,,METRICS,False,,False
cryptocurrency,1o87u13,Did you even say thank you?,Fritz1818,2025-10-16T15:35:29,5284,0.98,126,https://i.redd.it/420dwjxkihvf1.png,https://reddit.com/r/CryptoCurrency/comments/1o87u13/did_you_even_say_thank_you/,,DISCUSSION,False,,False
cryptocurrency,1o3yuxc,Maybe i should have sold instead of taking a screenshot,Odd-Radio-8500,2025-10-11T16:43:18,4848,0.98,194,https://i.redd.it/0lqc1pfk6iuf1.jpeg,https://reddit.com/r/CryptoCurrency/comments/1o3yuxc/maybe_i_should_have_sold_instead_of_taking_a/,,MEME,False,,False
cryptocurrency,1of0jrt,Before the CZ pardon. Binance took up a sizeable portion in USD1 giving the Trump family ~$50M a year in yield farming on Treasury Bonds.,GabeSter,2025-10-24T16:18:41,4650,0.98,263,https://i.redd.it/94qp30xwt2xf1.png,https://reddit.com/r/CryptoCurrency/comments/1of0jrt/before_the_cz_pardon_binance_took_up_a_sizeable/,,DISCUSSION,False,,False
cryptocurrency,1oe6s9b,U.S. President Donald Trump Pardons Binance Founder CZ,meeleen223,2025-10-23T16:45:55,4567,0.96,613,https://www.coindesk.com/policy/2025/10/23/binance-s-cz-wins-pardon-from-u-s-president-donald-trump,https://reddit.com/r/CryptoCurrency/comments/1oe6s9b/us_president_donald_trump_pardons_binance_founder/,,DISCUSSION*,False,,False
cryptocurrency,1o4u3j3,The Bull market is back,Odd-Radio-8500,2025-10-12T17:49:39,4491,0.96,160,https://i.redd.it/169w00kbnpuf1.jpeg,https://reddit.com/r/CryptoCurrency/comments/1o4u3j3/the_bull_market_is_back/,,MEME,False,,False
cryptocurrency,1o8k3xr,I’m cooked,002_timmy,2025-10-16T23:20:16,4481,0.98,423,https://i.redd.it/9ehptqjytjvf1.jpeg,https://reddit.com/r/CryptoCurrency/comments/1o8k3xr/im_cooked/,,COMEDY,False,,False
cryptocurrency,1nwdap3,Would you solve a captcha in 2010 for $600K today?,002_timmy,2025-10-02T20:24:34,4156,0.96,220,https://i.redd.it/ehtxtqsp1rsf1.png,https://reddit.com/r/CryptoCurrency/comments/1nwdap3/would_you_solve_a_captcha_in_2010_for_600k_today/,,LEGACY,False,,False
cryptocurrency,1of42xc,How crypto really works,Odd-Radio-8500,2025-10-24T18:34:05,3826,0.98,54,https://i.redd.it/hf8l3yc6i3xf1.jpeg,https://reddit.com/r/CryptoCurrency/comments/1of42xc/how_crypto_really_works/,,MEME,False,,False
cryptocurrency,1o3hfqg,"In hindsight, it was obvious",002_timmy,2025-10-11T01:15:49,3585,0.99,93,https://i.redd.it/vq6a99v3lduf1.jpeg,https://reddit.com/r/CryptoCurrency/comments/1o3hfqg/in_hindsight_it_was_obvious/,,COMEDY,False,,False
cryptocurrency,1o5mljv,"The Whale who perfectly timed the dump on Friday making hundreds of millions started shorting again and nobody knows if it's a psyop, or if they have insider info to suggest it's going to dump again.",GabeSter,2025-10-13T16:19:04,3548,0.97,446,https://i.redd.it/lqirh5rybwuf1.png,https://reddit.com/r/CryptoCurrency/comments/1o5mljv/the_whale_who_perfectly_timed_the_dump_on_friday/,,DISCUSSION,False,,False
cryptocurrency,1o1omf6,Forever Weak Forever Paper Hands,goldyluckinblokchain,2025-10-08T22:57:30,3319,0.83,165,https://i.redd.it/yoiuefslmytf1.jpeg,https://reddit.com/r/CryptoCurrency/comments/1o1omf6/forever_weak_forever_paper_hands/,,MEME,False,,False
cryptocurrency,1nyy09z,Satoshi's wallet is now worth over $135B; This would make him the 9th richest person on earth,Next_Statement6145,2025-10-05T20:44:58,3223,0.97,446,https://www.reddit.com/gallery/1nyy09z,https://reddit.com/r/CryptoCurrency/comments/1nyy09z/satoshis_wallet_is_now_worth_over_135b_this_would/,,GENERAL-NEWS,False,,False
cryptocurrency,1odcnah,RIP crypto 😔,Odd-Radio-8500,2025-10-22T17:13:12,3154,0.96,288,https://i.redd.it/5b1jecmwtowf1.jpeg,https://reddit.com/r/CryptoCurrency/comments/1odcnah/rip_crypto/,,MEME,False,,False
cryptocurrency,1ohw71s,"US Rep. Ro Khanna introduces legislation to ban President DJT, congressmembers from trading crypto",Dongerated,2025-10-28T02:04:24,3047,0.98,97,https://www.kron4.com/news/bay-area/ro-khanna-introduces-legislation-to-ban-trump-congressmembers-from-trading-crypto/amp/,https://reddit.com/r/CryptoCurrency/comments/1ohw71s/us_rep_ro_khanna_introduces_legislation_to_ban/,,🟢 GENERAL-NEWS,False,,False
cryptocurrency,1ny0xou,Michelangelo Would Be Proud,goldyluckinblokchain,2025-10-04T19:03:59,3027,0.98,25,https://i.redd.it/qq8vonlax4tf1.jpeg,https://reddit.com/r/CryptoCurrency/comments/1ny0xou/michelangelo_would_be_proud/,,MEME,False,,False
cryptocurrency,1nu17xc,It's been a honor trading with ya'all,Odd-Radio-8500,2025-09-30T03:18:28,2831,0.98,100,https://i.redd.it/yla9vg6yo7sf1.jpeg,https://reddit.com/r/CryptoCurrency/comments/1nu17xc/its_been_a_honor_trading_with_yaall/,,MEME,False,,False
cryptocurrency,1o9qrt0,Free crypto advice,Odd-Radio-8500,2025-10-18T09:52:06,2817,0.98,51,https://i.redd.it/dv4e8zzk3uvf1.png,https://reddit.com/r/CryptoCurrency/comments/1o9qrt0/free_crypto_advice/,,MEME,False,,False
cryptocurrency,1o7lu02,I Can't Do it Master,goldyluckinblokchain,2025-10-15T21:13:31,2259,0.98,73,https://i.redd.it/dtfagvmf2cvf1.jpeg,https://reddit.com/r/CryptoCurrency/comments/1o7lu02/i_cant_do_it_master/,,MEME,False,,False
cryptocurrency,1oesuqa,Trader who made $190M shorting crash also apparently bet on CZ’s pardon,Next_Statement6145,2025-10-24T10:07:35,2133,0.98,125,https://cointelegraph.com/news/donald-trump-us-cz-binance-founder-pardon-crypto-trader-profit,https://reddit.com/r/CryptoCurrency/comments/1oesuqa/trader_who_made_190m_shorting_crash_also/,,🔴 UNRELIABLE SOURCE,False,,False
cryptocurrency,1o8c5tf,Uptober,Wise-Grapefruit-1443,2025-10-16T18:15:56,2073,0.98,88,https://i.redd.it/m7u5u4zf5ivf1.jpeg,https://reddit.com/r/CryptoCurrency/comments/1o8c5tf/uptober/,,MEME,False,,False
cryptocurrency,1nznmy4,How To Get Lucky In Bitcoin,kirtash93,2025-10-06T17:19:37,2032,0.96,136,https://i.redd.it/xeqb1nbgoitf1.png,https://reddit.com/r/CryptoCurrency/comments/1nznmy4/how_to_get_lucky_in_bitcoin/,Source: [https://x.com/bitcoin\_dad/status/1974690737489850453](https://x.com/bitcoin_dad/status/1974690737489850453),PERSPECTIVE,False,,False
cryptocurrency,1ohg8ye,Wen you’ve learned patience the hard way.,Odd-Radio-8500,2025-10-27T15:42:26,2022,0.97,51,https://i.redd.it/jazfzn1a2oxf1.jpeg,https://reddit.com/r/CryptoCurrency/comments/1ohg8ye/wen_youve_learned_patience_the_hard_way/,,MEME,False,,False
cryptocurrency,1oclvqf,Guess who wanted to share some news about China during the top of the pump today.,GabeSter,2025-10-21T20:06:53,2023,0.97,87,https://i.redd.it/82wefq3ujiwf1.png,https://reddit.com/r/CryptoCurrency/comments/1oclvqf/guess_who_wanted_to_share_some_news_about_china/,,MEME,False,,False
cryptocurrency,1o29n18,Gold Holder vs Bitcoiner,kirtash93,2025-10-09T16:52:46,1970,0.89,213,https://i.redd.it/7fjwtvkey3uf1.png,https://reddit.com/r/CryptoCurrency/comments/1o29n18/gold_holder_vs_bitcoiner/,Source: [https://x.com/naiivememe/status/1976232498310025578](https://x.com/naiivememe/status/1976232498310025578),MEME,False,,False
cryptocurrency,1o3347v,So real...altcoins still waiting for flight,Odd-Radio-8500,2025-10-10T15:54:25,1963,0.95,156,https://i.redd.it/4a0emzgxsauf1.jpeg,https://reddit.com/r/CryptoCurrency/comments/1o3347v/so_realaltcoins_still_waiting_for_flight/,,MEME,False,,False
cryptocurrency,1odbcuo,We were so close,GabeSter,2025-10-22T16:26:13,1952,0.94,104,https://i.redd.it/pdhcqz1jlowf1.png,https://reddit.com/r/CryptoCurrency/comments/1odbcuo/we_were_so_close/,,MEME,False,,False
cryptocurrency,1oie58h,Giant Bitcoin drone show in Switzerland showing BTC eating fiat currencies like Pac-Man,002_timmy,2025-10-28T17:31:02,1882,0.82,176,https://v.redd.it/qi1dioyiqvxf1,https://reddit.com/r/CryptoCurrency/comments/1oie58h/giant_bitcoin_drone_show_in_switzerland_showing/,,VIDEOS,False,,False
cryptocurrency,1o44vfk,Crypto is under attack,FlyingFistFuck,2025-10-11T20:45:18,1768,0.84,590,https://www.reddit.com/r/CryptoCurrency/comments/1o44vfk/crypto_is_under_attack/,https://reddit.com/r/CryptoCurrency/comments/1o44vfk/crypto_is_under_attack/,"Yesterday's massive market manipulation is the proof. 
Trump got all Crypto exchanges under the same roof and turned the cameras off, Together they plotted to make the rich richer whilst pumping the exchanges bags bigger.
We are now witnessing massive rug pulls of the entire market and we are paying the bill.
Nothing will be done. The FBI and SEC has been stripped and replaced with yes men, there is nobody to stop it happening and the culprit is America's president.

I am losing faith. Crypto was supposed to be our saviour to this problem, now it is infested by the same corporate asshats we dont trust with our own FIAT.",DISCUSSION,True,,False
cryptocurrency,1o4apdw,Coffeezilla: the craziest insider trade i've seen in a while,RaiausderDose,2025-10-12T01:00:41,1758,0.98,141,https://www.youtube.com/watch?v=5fTv9ThJg6U,https://reddit.com/r/CryptoCurrency/comments/1o4apdw/coffeezilla_the_craziest_insider_trade_ive_seen/,,MARKETS,False,,False
cryptocurrency,1o57mvq,Donald Trump accused of profiting from presidency as crypto ventures rake in hundreds of millions,CriticalCobraz,2025-10-13T03:19:54,1752,0.96,183,https://www.abc.net.au/news/2025-10-13/trump-president-wealth-family-business-crypto-four-corners/105876782,https://reddit.com/r/CryptoCurrency/comments/1o57mvq/donald_trump_accused_of_profiting_from_presidency/,,GENERAL-NEWS,False,,False
cryptocurrency,1o3ejwr,"Over $7,440,000,000 were liquidated in the past hour.",fu_paddy,2025-10-10T23:06:58,1642,0.96,479,https://www.reddit.com/r/CryptoCurrency/comments/1o3ejwr/over_7440000000_were_liquidated_in_the_past_hour/,https://reddit.com/r/CryptoCurrency/comments/1o3ejwr/over_7440000000_were_liquidated_in_the_past_hour/,"Almost $9,000,000,000 in the past 24 hours. Most alts dropped 70-90% for a few brief moments. SUI dropped 90% on Kraken. I believe this was a very well calculated event and the hands behind it are dirty. Absolutely nobody saw it coming. Trump has announced tariffs before but this was something else entirely.

I was reviewing the order books literally seconds before it happened and was wondering why there was such an unusual amount of buy orders at what seemed like impossible prices. Like, AVAX at \~$8, TAO $140, DOGE $0.09?  
I know, there are always buy orders at these level but this time the volume was MASSIVE. I mean, SUI dropped to 0.16. Come the fuck on...",ANALYSIS,True,,False
cryptocurrency,1o3w9wi,Ukrainian crypto influencer Kostya Kudo took his own life after recent market bleed which liquidated more than $19B,Silver-Maximum9190,2025-10-11T14:56:02,1619,0.96,350,https://i.redd.it/76kjizqfnhuf1.jpeg,https://reddit.com/r/CryptoCurrency/comments/1o3w9wi/ukrainian_crypto_influencer_kostya_kudo_took_his/,,GENERAL-NEWS,False,,False
cryptocurrency,1ofczdv,Cz after allegedly bribing Trump fam for a pardon: “President Trump and Satoshi. Might be the same person.”,GabeSter,2025-10-25T00:43:12,1553,0.91,352,https://i.redd.it/4whablh1c5xf1.jpeg,https://reddit.com/r/CryptoCurrency/comments/1ofczdv/cz_after_allegedly_bribing_trump_fam_for_a_pardon/,"I’m sure the tweet is 90% bait and 10% butt kissing but it’s 100% real

https://x.com/cz_binance/status/1981782733316927964?s=46&t=_XdO1MM-IScHom7IthfJPA",COMEDY,False,,False
cryptocurrency,1ofyl5x,"If BTC hits $116K, $4.8B in shorts will be liquidated.",Odd-Radio-8500,2025-10-25T19:16:55,1494,0.93,126,https://i.redd.it/3qk6fgrpuaxf1.jpeg,https://reddit.com/r/CryptoCurrency/comments/1ofyl5x/if_btc_hits_116k_48b_in_shorts_will_be_liquidated/,,MARKETS,False,,False
cryptocurrency,1nv9sxj,Happy Uptober,OfficialBONKfun,2025-10-01T15:31:25,1490,0.97,75,https://i.redd.it/mmtbfiymgisf1.jpeg,https://reddit.com/r/CryptoCurrency/comments/1nv9sxj/happy_uptober/,,MEME,False,,False
cryptocurrency,1o41jxr,Maybe Next Year,goldyluckinblokchain,2025-10-11T18:31:42,1332,0.97,75,https://i.redd.it/cehccxzwpiuf1.jpeg,https://reddit.com/r/CryptoCurrency/comments/1o41jxr/maybe_next_year/,,MEME,False,,False
cryptocurrency,1ntzasw,Buttcoin getting ratioed,CriticalCobraz,2025-09-30T01:49:07,1305,0.94,215,https://i.redd.it/tyh1nu1334sf1.jpeg,https://reddit.com/r/CryptoCurrency/comments/1ntzasw/buttcoin_getting_ratioed/,,PERSPECTIVE,False,,False
cryptocurrency,1o6mdoj,Neuron Activation,kirtash93,2025-10-14T18:45:18,1208,0.97,36,https://i.redd.it/r5v3q4yz64vf1.png,https://reddit.com/r/CryptoCurrency/comments/1o6mdoj/neuron_activation/,Source: [https://x.com/naiivememe/status/1977929844643303763](https://x.com/naiivememe/status/1977929844643303763),MEME,False,,False
cryptocurrency,1oaxsiz,trump announces tariffs. market crashes. then he says they're not sustainable and market starts gradually rising. trump family made $1b on crypto. what's going on here?,Gullible-Tale9114,2025-10-19T19:54:34,1186,0.92,311,https://www.reddit.com/r/CryptoCurrency/comments/1oaxsiz/trump_announces_tariffs_market_crashes_then_he/,https://reddit.com/r/CryptoCurrency/comments/1oaxsiz/trump_announces_tariffs_market_crashes_then_he/,"oct 10: trump threatened 100% tariffs. markets panicked and about $16–19 billion in leveraged crypto positions were liquidated, wiping out many traders.

days later: he confirmed a meeting with xi and said the 100% tariff idea was “not sustainable,” effectively softening the policy stance that helped trigger the sell off.

meanwhile: the Financial Times reports the trump family has made roughly $1 billion in pre-tax profits from crypto ventures since the election. that reporting is the basis for the conflict of interest concerns.

the timing looks sus. whatis going on here?

political theater? scare china with a hard line, negotiate back. tariffs become leverage, not the end goal. traders get collateral damage. normal trade negotiation stuff.

policy testing? drop a shock to see market reaction, then calibrate strategy based on fallout. messy but plausible.

conflict of interest? if the family had holdings exposed, a crash and subsequent policy pivot could create trading opportunities. the optics are bad... and that alone justifies independent scrutiny and disclosure.

genuine error? trump makes a bad call, sees chaos, steps back.

regardless of intent, markets hate unpredictability. real people lost real money. a president whose family profits from the industry he regulates raises serious conflict of interest questions.

watch for : asset disclosures tied to policy moves. on-chain data for large wallet trades. congressional pressure for answers. if you were liquidated or sold during the panic, you're likely sitting on taxable events even if you lost money overall. capital losses can offset gains, but only if you report them correctly. given the volatility and political manipulation at play, accurate tax reporting matters more than ever (tools like awaken can help sort through the chaos of liquidations and trades during wild market swings).",ANALYSIS,True,,False
cryptocurrency,1ogndz0,BTC has closed above $100K for 170 days straight,Next_Statement6145,2025-10-26T16:24:54,1178,0.94,106,https://www.reddit.com/gallery/1ogndz0,https://reddit.com/r/CryptoCurrency/comments/1ogndz0/btc_has_closed_above_100k_for_170_days_straight/,,GENERAL-NEWS,False,,False
cryptocurrency,1ocon58,"Bitcoin whale opens $235M BTC short, after netting $200M from market crash",partymsl,2025-10-21T21:50:07,1132,0.96,155,https://cointelegraph.com/news/11b-bitcoin-whale-235m-btc-short-market-crash,https://reddit.com/r/CryptoCurrency/comments/1ocon58/bitcoin_whale_opens_235m_btc_short_after_netting/,,🔴 UNRELIABLE SOURCE,False,,False
cryptocurrency,1odciuq,I hope everyone understands how manipulated this has become?,tawhuac,2025-10-22T17:08:32,1122,0.92,474,https://www.reddit.com/r/CryptoCurrency/comments/1odciuq/i_hope_everyone_understands_how_manipulated_this/,https://reddit.com/r/CryptoCurrency/comments/1odciuq/i_hope_everyone_understands_how_manipulated_this/,"Everyone was cheering institutional investors, crypto funds and what not. And got glowy eyes as the prices were going up.

But do we realize how manipulated this has become? What do we think are this people in for? Yes, profits. Just profits. 

Whales and funds will pump and dump this at-will, when they want, how they want. This has become a casino, outright betting, where the house always wins. And the other participants at large, we will scramble guessing when the curve rises and when it falls. And I assume most will be happy going along.

This is not even capitalism anymore, don't be fooled. Capitalism is supposed to have rules, even certain morales. This can safely be called scamming, even with no conventional means of counterweights. ",PERSPECTIVE,True,,False
cryptocurrency,1nwx073,Crypto bros can be so delusional,OfficialBONKfun,2025-10-03T12:53:21,1104,0.94,122,https://i.redd.it/hviq6kd9yvsf1.jpeg,https://reddit.com/r/CryptoCurrency/comments/1nwx073/crypto_bros_can_be_so_delusional/,,COMEDY,False,,False
cryptocurrency,1o63huv,Another banger by u/BoldLeonidas,002_timmy,2025-10-14T03:22:24,1100,0.94,68,https://i.redd.it/rlxzmhbfmzuf1.jpeg,https://reddit.com/r/CryptoCurrency/comments/1o63huv/another_banger_by_uboldleonidas/,,COMEDY,False,,False
cryptocurrency,1o8v2b8,Wen TAs stop making sense and you relying on hope...,Odd-Radio-8500,2025-10-17T08:41:16,1073,0.87,91,https://i.redd.it/e61o0qh1mmvf1.jpeg,https://reddit.com/r/CryptoCurrency/comments/1o8v2b8/wen_tas_stop_making_sense_and_you_relying_on_hope/,,MEME,False,,False
cryptocurrency,1oavtb4,BTC only needs to go up 15% to wipe out $17B in shorts,Next_Statement6145,2025-10-19T18:38:37,1041,0.93,138,https://www.reddit.com/gallery/1oavtb4,https://reddit.com/r/CryptoCurrency/comments/1oavtb4/btc_only_needs_to_go_up_15_to_wipe_out_17b_in/,,GENERAL-NEWS,False,,False
cryptocurrency,1nwznvy,Bitcoiners while US government shuts down,Odd-Radio-8500,2025-10-03T14:48:19,1033,0.91,75,https://i.redd.it/69jrpikriwsf1.jpeg,https://reddit.com/r/CryptoCurrency/comments/1nwznvy/bitcoiners_while_us_government_shuts_down/,,MEME,False,,False
cryptocurrency,1ohvp52,Trump Sons' American Bitcoin Stock Jumps After Adding $163 Million to BTC Treasury,Abdeliq,2025-10-28T01:41:42,1014,0.95,111,https://decrypt.co/346068/trump-sons-american-bitcoin-jumps-adding-163-million-treasury,https://reddit.com/r/CryptoCurrency/comments/1ohvp52/trump_sons_american_bitcoin_stock_jumps_after/,,GENERAL-NEWS,False,,False
cryptocurrency,1o137sp,A Real Man Knows What He Likes,kirtash93,2025-10-08T07:40:19,980,0.86,86,https://i.redd.it/6mmjuoow2utf1.png,https://reddit.com/r/CryptoCurrency/comments/1o137sp/a_real_man_knows_what_he_likes/,Source: [https://x.com/naiivememe/status/1975740533772587013](https://x.com/naiivememe/status/1975740533772587013),MEME,False,,False
cryptocurrency,1o6cnie,Just got this letter,VitoHodl,2025-10-14T12:15:04,978,0.96,310,https://www.reddit.com/gallery/1o6cnie,https://reddit.com/r/CryptoCurrency/comments/1o6cnie/just_got_this_letter/,Be safe out there.,ADVICE,False,,False
cryptocurrency,1o6kgo3,The feds say two brothers stole $25 million in crypto in 12 seconds. The defense says they merely outsmarted bots.,qbl500,2025-10-14T17:35:45,969,0.98,172,https://www.businessinsider.com/crypto-brothers-peraire-bueno-trial-heist-ethereum-blockchain-arguments-2025-10,https://reddit.com/r/CryptoCurrency/comments/1o6kgo3/the_feds_say_two_brothers_stole_25_million_in/,,🟢 GENERAL-NEWS,False,,False
cryptocurrency,1oa1oav,A whale with over $500M in shorts now has an unrealized PnL of $39M,Next_Statement6145,2025-10-18T18:24:32,918,0.95,156,https://www.reddit.com/gallery/1oa1oav,https://reddit.com/r/CryptoCurrency/comments/1oa1oav/a_whale_with_over_500m_in_shorts_now_has_an/,,GENERAL-NEWS,False,,False
cryptocurrency,1ny1h9m,I Never Learn,kirtash93,2025-10-04T19:24:54,917,0.98,25,https://i.redd.it/7vsht6wz05tf1.png,https://reddit.com/r/CryptoCurrency/comments/1ny1h9m/i_never_learn/,Source: [https://x.com/naiivememe/status/1974369142817087842](https://x.com/naiivememe/status/1974369142817087842),MEME,False,,False
cryptocurrency,1nzzaez,"Thank you, Laszlo, for your sacrifice",002_timmy,2025-10-07T00:44:09,853,0.94,63,https://i.redd.it/kbx07g6tvktf1.jpeg,https://reddit.com/r/CryptoCurrency/comments/1nzzaez/thank_you_laszlo_for_your_sacrifice/,,LEGACY,False,,False
cryptocurrency,1ny62sr,"Trump’s $2,000 Tariff ‘Dividend’ Stimulus Check Idea Could Be About To Blow Up The Bitcoin Price, Crypto And Stock Market",WiseChest8227,2025-10-04T22:28:00,851,0.87,193,https://www.forbes.com/sites/digital-assets/2025/10/04/trumps-2000-tariff-dividend-stimulus-check-idea-could-be-about-to-blow-up-the-bitcoin-price-crypto-and-stock-market/,https://reddit.com/r/CryptoCurrency/comments/1ny62sr/trumps_2000_tariff_dividend_stimulus_check_idea/,,GENERAL-NEWS,False,,False
cryptocurrency,1o3u9m4,Simple summary of the alt-pocalypse yesterday,bledig,2025-10-11T13:23:09,841,0.96,196,https://www.reddit.com/gallery/1o3u9m4,https://reddit.com/r/CryptoCurrency/comments/1o3u9m4/simple_summary_of_the_altpocalypse_yesterday/,"I am not the best person to explain how bad and manipulative yesterdays event was but I see no good explanations here so I will try

It’s very simplified, but just remember many ppl are hurt bad not even their fault. So let’s be there for each other

And fk your - just don’t use leverage hurrdurrr. This event killed even the lowest leverage safe traders. Entire portfolio wiped out of they are cross leveraged. Have some empathy

Twitter have been filled with suicide hotline so if some of u are hurt feel free to msg me and I can be a listening ear
",ANALYSIS,False,,False
cryptocurrency,1ofzxfg,Meteora Crashes 40% After Giving Trump Team $4.2M - Hours After Founder Sued for orchestrating $57 million in pump-and-dump schemes using endorsements from Melania Trump and Argentine President Javier Milei,CriticalCobraz,2025-10-25T20:11:54,838,0.97,79,https://finance.yahoo.com/news/meteora-gave-trump-team-4-091931328.html,https://reddit.com/r/CryptoCurrency/comments/1ofzxfg/meteora_crashes_40_after_giving_trump_team_42m/,,GENERAL-NEWS,False,,False
cryptocurrency,1nx54f0,Son One Day You'll Be A Man,kirtash93,2025-10-03T18:13:24,831,0.94,79,https://i.redd.it/iigbuo9ajxsf1.png,https://reddit.com/r/CryptoCurrency/comments/1nx54f0/son_one_day_youll_be_a_man/,Source: [https://x.com/naiivememe/status/1973972811086811352](https://x.com/naiivememe/status/1973972811086811352),MEME,False,,False
cryptocurrency,1o5pqml,Strategy has acquired 220 BTC for ~$27.2 million,Next_Statement6145,2025-10-13T18:11:21,832,0.95,106,https://www.reddit.com/gallery/1o5pqml,https://reddit.com/r/CryptoCurrency/comments/1o5pqml/strategy_has_acquired_220_btc_for_272_million/,,GENERAL-NEWS,False,,False
cryptocurrency,1nuxpce,We're back...,Odd-Radio-8500,2025-10-01T04:28:57,785,0.95,60,https://i.redd.it/pd4vmalf6fsf1.jpeg,https://reddit.com/r/CryptoCurrency/comments/1nuxpce/were_back/,,MEME,False,,False
cryptocurrency,1o1kbg7,Seat where all the strategies are brewed.,Odd-Radio-8500,2025-10-08T20:25:43,778,0.98,25,https://i.redd.it/cnfoy0divxtf1.jpeg,https://reddit.com/r/CryptoCurrency/comments/1o1kbg7/seat_where_all_the_strategies_are_brewed/,,MEME,False,,False
cryptocurrency,1o4lw2f,"No one, and I mean no one has a clue what is actually happening, don't listen to anyone.",IndecisiveEnthusiast,2025-10-12T11:44:22,777,0.93,246,https://www.reddit.com/r/CryptoCurrency/comments/1o4lw2f/no_one_and_i_mean_no_one_has_a_clue_what_is/,https://reddit.com/r/CryptoCurrency/comments/1o4lw2f/no_one_and_i_mean_no_one_has_a_clue_what_is/,"There is absolutely no one who has a clue what is going on, and that's the truth. Block chain backer, a renowned DD YouTube said 'Stuck at highs' not even 5 hours later one of the biggest crashes in history happened. 

There are hundred of finance gurus who said the same thing, trust me, no one has a clue. The average Joe in wall street hasn't got a clue what's going on, the guys you see on here with 4 million in their accounts, they don't have a clue. You don't know, I don't know. The only guys who know are politicians, whales, and elites. 

If you wanna buy, buy. If you wanna sell, sell. There are no amount of drawing straight lines on a chart that will help.

We are gambling, lets not look too deep into it. ",ADVICE,True,,False
cryptocurrency,1ocd8x0,Uptober explained,Odd-Radio-8500,2025-10-21T14:39:58,774,0.96,72,https://i.redd.it/t43r3q5oxgwf1.jpeg,https://reddit.com/r/CryptoCurrency/comments/1ocd8x0/uptober_explained/,,MEME,False,,False
